date,day,word,text,label
20220331,목,카카오,"카카오가 사내독립법인(CIC)을 별도법인으로 확대하며 600조원 규모의 글로벌 디지털 헬스케어 시장에 진출한다는 소식에 카카오가 지난해 11월 150억원을 투자해 최대주주에 오른 휴먼스케이프의 주요 투자자인 케어랩스가 강세다.31일 한국거래소에 따르면 케어랩스는 오후 2시50분 현재 전일 대비 870원(10.08%) 상승한 9500원에 거래되고 있다.이날 관련업계에 따르면 카카오는 지난 17일 카카오헬스케어(가칭) 법인을 신규설립했다. 대표는 황희 헬스케어 CIC 대표가 맡는다. 법인등기부등본에 따르면 카카오헬스케어는 사업목적에 ▲시스템통합구축서비스 판매업 ▲인터넷 EDI(전자문서교환) 등 인터넷 관련사업 ▲정보시스템 종합관리(전산자원대여·데이터베이스) 및 유지보수 용역업 ▲인공지능(AI) 기반 의료솔루션 개발 및 서비스업 ▲건강관리서비스업 등을 기재했다. 이용자뿐 아니라 의료진·의료기관 대상으로 B2B 사업도 전개하는 셈이다.지난해 12월 카카오는 글로벌 디지털 헬스케어 사업을 전담할 헬스케어 CIC를 설립하고 황희 분당서울대병원 교수를 영입했다. 황 대표는 이지케어텍 부사장으로서 클라우드 전자의무기록(EMR) 시스템을 선보였다. 2019년 미국의료정보학회(HIMSS)로부터 디지털 헬스케어 혁신리더 50인에 선정될 정도로 업계를 상징하는 인물이다.카카오헬스케어는 국내 서비스를 먼저 선보이고, 의료분야 디지털 전환이 더딘 해외시장에 진출할 예정이다. 카카오의 글로벌 성장축이 콘텐츠·블록체인에서 디지털 헬스케어로 확대되는 셈이다. 황 대표는 ""그동안 의료와 헬스케어 영역에서 쌓아온 경험을 기반으로 카카오가 글로벌 시장에서 디지털 헬스케어 분야를 혁신할 수 있도록 최선을 다하겠다""라고 말했다.한편, 케어랩스는 지난해 카카오가 150억원의 지분투자를 통해 최대주주에 올라선 휴먼스케이프의 주요 투자자로 카카오는 휴먼스케이프의 IT 기술이 그룹 차원의 글로벌 헬스케어 확장 전략에 도움이 될 것이라고 내다봤다고 밝혔다.",1
20220331,목,카카오,"종합 플랫폼업체로 도약할 것투게더앱스는 29일 오전 서울 강남구 ST타워에서 제7기 정기 주주총회를 열고 박세진 투게더펀딩(투게더앱스) 부대표를 신임 대표이사로 선임했다.박세진 투게더펀딩(투게더앱스) 신임 대표이사는 “주택담보대출 상품을 넘어 차주와 투자자를 연결하는 종합 플랫폼업체가 되도록 노력하겠다”고 밝혔다.이어 “압도적인 기술력을 가진 1등 플랫폼 기업들은 외부 요인과 관계없이 안정적으로 성장했다”며 “투게더앱스는 차세대 IT 시스템을 통한 자동화와 자가학습 상품평가 시스템 개발을 통한 상품 안전성의 확보 두 성장축을 바탕으로 사업 역량을 집중할 것”이라고 말했다.박세진 투게더펀딩(투게더앱스) 신임 대표이사는 “주택담보대출 상품을 넘어 차주와 투자자를 연결하는 종합 플랫폼업체가 되도록 노력하겠다”고 말했다. [사진=투게더앱스]또 박 대표는 “경쟁사와 시장의 성장을 뛰어넘는 지속 성장으로 ‘초일류 테크(Tech) 금융사’가 되도록 노력하겠다”며 “온투업 시장이 성장 기조를 이어가고 있지만 코로나19, 인플레이션, P2P 업계의 성장 곡선 둔화 등으로 쉽지만은 않을 것”이라고 강조했다.최근 투게더앱스는 핀다, 핀크, 뱅크샐러드, 핀셋, 카카오페이, 뱅크몰, 나이스평가정보 등과 제휴를 맺고 영업채널 다각화를 통한 차주 모집 확대에 나서고 있다. 또한 쿠팡 등의 오픈마켓과의 제휴를 통한 선정산 서비스 런칭도 검토 중이다.박세진 대표는 “최근 중요성이 확대되는 제휴 확대를 통한 상생의 경영을 실천할 것”이라며 “상품 다각화를 통한 영업 실적 개선을 제1원칙으로 삼아 지속가능 경영을 최우선으로 하겠다”고 설명했다.투게더펀딩은 앞으로 주식을 연계한 스탁론, 오픈마켓과의 제휴를 통한 선정산 시스템, 직장인을상대로하는 페이론, 종합 신용대출 서비스 등 신시장 개척에도 집중할 예정이다.투게더앱스 관계자는 “박 대표이사는 내부 승진을 통해 대표이사에 오른 만큼 P2P 분야에서 높은 전문성과 업무 능력을 선보이고 있다”며 “새로운 최대 주주와 새로운 대표의 사업 전략이 일치하는 만큼 적극적인 자세로 시장을 선점해 나아갈 것”이라고 전했다.한편, 온투업은 인터넷을 통해 투자자와 대출 희망자를 연결해주는 서비스다. 대출을 받고자 하는 차주의 상환 능력에 따라 책정한 대출조건을 온라인을 통해 다수의 개인투자자와 연결해주는 방식이다. 대출을 원하는 차주는 온투업체를 통해 기존의 대부시장 이자율보다 현저히 낮은 금리로 대출을 받을 수 있다. 실제로 온투업체들은 1금융과 2금융 사이 '1.5금융'을 포인트로 내세워 홍보하고 있다. 투자자의 경우에도 안정적인 수익을 기대할 수 있어 온투업이 매력이 높은 투자처로 꼽힌다.",0
20220331,목,카카오,"금융위, '포인트 기반 체크카드' 허용비씨카드 관련 상품 4월 출시비씨카드가 다음 달부터 선불 충전금 서비스인 페이북머니와 연계한 체크카드를 출시한다.다음 달부터 기존 금융 거래 계좌가 없더라도 포인트에 연동한 체크카드 발급이 가능해진다. 기존 금융사도 카카오페이, 네이버페이처럼 선불 충전금을 활용한 결제 시스템을 갖추게 된 셈이다.금융위원회는 31일 전날 열린 정례회의에서 비씨카드의 '포인트 기반 체크카드 발급 서비스'를 혁신금융서비스로 신규 지정했다고 밝혔다.여신전문금융업법상 체크카드는 금융거래 계좌가 있어야만 발급할 수 있다. 하지만 규제를 일정 기간 동안 적용하지 않는 혁신금융서비스 지정으로 금융거래 계좌 없이 본인 인증만으로 간편하게 포인트를 기반에 둔 체크카드를 발급받을 수 있게 됐다.비씨카드는 자사가 운영 중인 페이북머니와 연계해 관련 체크카드를 다음 달 출시할 예정이다. 페이북머니는 일정 금액을 충전하면 포인트처럼 쓸 수 있는 선불 지급수단으로 카카오페이, 네이버페이와 비슷한 구조다.기존 금융사가 선불 지급수단을 바탕으로 한 체크카드를 선보이는 건 처음이다. 비씨카드는 카카오페이 등이 주름잡고 있는 온라인 결제 시장뿐 아니라 오프라인에서도 이 체크카드를 사용할 수 있다고 설명했다.",0
20220331,목,카카오,"자본시장을 감독하는 금융당국 고위직 자녀들이 소액의 주식투자를 통해 경제공부를 하는 것으로 나타났다. 금융위원회는 코로나19 대유행을 계기로 전국적인 주식투자 열풍이 불면서 고위공직자 가족들도 공모주를 비롯한 투자에 가세한 것이다.31일 정부가 공개한 올해 고위공직자 재산공개에 따르면 이세훈 금융위원회 사무처장의 장남은 지엔원에너지와 카카오, 휴먼엔 등 14만원 어치 상장주식을 보유하고 있다. 삼성전자와 한국전력공사, 한온시스템 등은 일년새 매도했다. 김동회 금융감독원 부원장도 장녀와 차녀가 각각 268만과 99만원 상당의 상장주식을 갖고있다. 장녀의 경우 DB손해보험과 메리츠증권, 에코프로, 엘앤에프 등을 10주 이하로 투자했고, 차녀는 SK하이닉스와 삼성전자, 엘앤에프 등을 매수했다. 김 부원장은 배우자도 지난해 역대급 공모주로 관심을 모았던 SK아이테크놀로지 2주 등 7개 종목의 상장주식을 1~4주 보유하고 있다. 김 부원장은 가족의 주식투자와 관련해 ""경제·금융시장에 대한 이해와 관심 제고, 공모주 청약 등을 위해 소액으로 여유자금을 투자""했다고 재산공개 자료에 설명했다. 이진석 금감원 부원장보의 장녀는 코링과 그레이코, TSCM 등 해외 주식을 3주 이하로 취득했다.재산공개 대상인 고위공직자는 가족 포함 3000만원까지 국내 상장주식을 보유할 수 있다. 다만 금융위의 경우 4급 이상은 국내 주식거래를 아예 못하도록 권고하고 있고, 금융감독원은 전직원을 대상으로 분기별 10회 이하로 주식 거래를 제한하고 있다. 금융위와 금감원 펀드와 상장지수펀드(ETF), 해외주식은 거래가 가능하다. 김정각 금융위 금융정보분석원장의 배우자는 랩상품을 통해 1억원 상당의 국내 주식에 투자하고 있다. 지난해 금융위 상임위원에 합류한 김용재 고려대 교수는 해외주식인 텔러닥헬스 10주를 신고했고, 비상장주식인 하임바이오 300주를 보유 중이다.",0
20220331,목,카카오,"31일 오전 서울 중구 하나은행 딜링룸에서 딜러들이 업무를 보고 있다.[서울경제]코스피가 오후장에서 2750~2760선 사이를 오르내리고 있다. 개인의 매도세가 이어지는 가운데 외국인과 기관의 매수세가 하방을 제한하는 모습이다.31일 오후 2시 기준 코스피 지수는 전 거래일보다 10.82(0.39%) 오른 2757.56을 나타내고 있다. 2745로 개장한 코스피는 2760선을 오르내리다가 현재는 2760선을 밑도는 중이다.유가증권시장에서는 개인이 2131억 원을 순매도 중인 가운데 외국인과 기관이 각각 707억 원, 1515억 원을 사들이면서 지수를 방어하고 있다. 특히 금융투자업계가 833억 원을 사들이면서 기관 매수세를 이끌고 있다.코스피 시가총액 상위 10위권은 삼성SDI(006400)(5.88%), LG에너지솔루션(373220)(0.23%) 등 2차전지 관련주가 상승세다. NAVER(035420)(0.59%), LG화학(051910)(0.76%), 기아(000270)(0.27%)도 강세다. 반면 SK하이닉스(000660)(-2.07%), 삼성바이오로직스(207940)(-1.9%), 카카오(035720)(-0.47%), 현대차(005380)(-0.83%)는 하락세다.같은 시각 코스닥 지수는 전일 대비 4.36(0.46%) 오른 943.43을 기록하고 있다. 개인과 기관이 각각 800억 원, 31억 원을 순매도하고 있지만 외국인이 920억 원을 사들이며 지수 상승세를 지지하고 있다.코스닥 시총 상위 종목 중에서도 2차전지 소재주들이 강세다. 엘앤에프(066970)(6.83%), 에코프로비엠(247540)(2.55%), 천보(278280)(2.13%)가 상승세를 이끌고 있으며 위메이드(112040)(3.80%), HLB(028300)(1.83%), CJ ENM(035760)(1.78%)도 강세다. 반면 셀트리온헬스케어(-0.91%), 펄어비스(-2.36%), 카카오게임즈(-0.64%) 등은 약세다.",0
20220331,목,카카오,"에디슨EV, 회계법인 감사의견 ‘거절’에 상장폐지 사유 발생31일 한국거래소에 따르면 에디슨EV는 전날 거래정지에 들어갔다. 에디슨EV의 모회사 에디슨모터스는 쌍용차 인수에 나서기로 했으나 인수대금 예치에 실패하며 인수가 불발됐다. /쌍용차 제공에디슨EV가 거래정지에 들어간 가운데 에디슨EV의 소액 투자자들이 날벼락을 맞았다. 최악의 경우 상장폐지로 이어진다면 막대한 손실을 피하기 어려울 전망이다.31일 한국거래소에 따르면 에디슨EV는 전 거래일부터 거래정지에 들어갔다.거래정지되기 직전 거래일인 29일 주가는 롤러코스터를 탔다. 1만 원으로 시작해 장 초반 전일 대비 28.82% 하락한 8720원까지 추락했지만 장 후반에는 21.63% 상승한 1만4900원까지 올라왔다. 변동폭만 66%를 넘으면서 거래대금은 시가총액인 3352억 원을 넘어서 4100억 원대를 넘나들었다.투자자들이 갑작스레 몰린 것은 쌍용차 인수 계약 해지 통보에 대해 효력 정지를 위한 가처분 신청 공시가 나오면서다. 앞서 에디슨EV의 모회사 에디슨모터스는 쌍용차 인수에 나서기로 했으나 계약금으로 지급한 305억 원을 제외한 잔금 2743억 원 지급에 실패하며 계약이 자동 해지됐다. 그러나 가처분 신청 공시가 나오면서 쌍용차 인수 가능성이 무산된 것이 아니라고 판단한 투자자들의 매수세가 몰린 것이다.하지만 거래소 코스닥시장본부는 같은날 감사의견 비적정과 관련해 사실여부에 대한 조회 공시를 요구하고,, 에디슨EV의 감사인인 삼화회계법인은 '의견 거절'이 나타난 감사보고서를 공시했다. 이에 거래소는 투자자 보호를 위해 거래를 정지한다고 밝히며 에디슨EV의 주식매매 거래 정지에 들어갔다.에디슨EV가 감사보고서를 제출하지 못하는 상황에서도 쌍용차 인수 계약과 관련한 소송에 나서면서 매수세가 몰렸고, 뒤늦게 거래가 정지된 것이다.최악의 경우엔 이대로 에디슨EV의 상장폐지로 이어져 발이 묶인 투자자들의 주식이 휴지조각이 될 가능성이 있다.에디슨EV가 지난해 재무제표에 대해 감사의견 '거절'을 받으면서 상장폐지 가능성이 높아졌다. 코스닥 상장사는 부적정, 의견거절, 범위제한 한정 등 비적정 감사의견을 받으면 모두 상장폐지 대상에 오른다.의견거절은 △감사보고서를 만드는데 필요한 증거를 얻지 못해 재무제표 전체에 대한 의견표명이 불가능한 경우 △기업의 존립에 의문을 제기할 만한 객관적인 사항이 중대한 경우 △감사인이 독립적인 감사업무를 수행할 수 없는 경우에 해당된다.삼화회계법인은 에디슨EV에 대해 ""유동부채가 유동자산을 초과하고 있고 영업손실도 지속되고 있어 회사가 계속기업으로서의 존속 능력에 불확실성이 존재한다""며 ""회사의 매출 증대 등을 통한 재무개선 및 유동성 확보 계획에 대한 충분하고 적합한 감사증거를 입수할 수 없었다""고 설명했다.에디슨EV의 거래정지 기간은 코스닥시장본부의 상장폐지 여부가 판가름날 때까지 이어질 전망이다. /박경현 기자에디슨EV의 거래정지 기간은 코스닥시장본부의 상장폐지 여부가 판가름날 때까지 이어질 전망이다. 상폐 결정 시 에디슨EV는 이의신청에 나설 가능성이 있다. 상장폐지 통지를 받은 기업은 기업은 통지를 받은 날로부터 15일 이내(영업일 기준)에 이의신청을 할 수 있다.거래소는 ""내달 11일까지 동일한 감사인의 해당 사유 해소에 대한 확인서를 제출하지 못하는 경우 회사는 상장폐지 사유에 해당한다""고 공시했다. 확인서를 제출하더라도 차기 재무제표에 대한 감사의견으로 부적정, 의견거절 또는 범위 제한 한정을 받으면 상장폐지 사유에 해당한다.지난해 말 기준 에디슨EV의 소액주주는 10만4615명이며 지분 80.34%를 보유하고 있다.한편, 거래소는 에디슨모터스의 쌍용차 인수 추진 과정에서 에디슨EV 대주주의 주식 처분에 불공정 행위가 있었는지에 대해서도 심층 분석에 들어간 상태다. 에디슨EV 주가는 지난해 5월 6000원대였지만 에디슨모터스가 쌍용차 인수를 추진한다는 소식에 11월에는 6만 원대로 10배가량 급등한 바 있다.이 과정에서 대주주 투자조합이 주식 대부분을 처분하는 등 '먹튀' 논란이 빚어지고 쌍용차 인수에 실패하자 금융당국은 에디슨모터스가 인수 능력이 없는데도 주가 시세 차익을 노리고 인수전에 뛰어든 것은 아닌지 살피고 있다.한 증권업계 관계자는 ""에디슨EV는 에디슨모터스의 쌍용차 인수 기대감에 주가가 6만 원이 넘는 등 주가가 크게 뛴 과정에서 의혹을 받고 있다""며 ""더불어 잔금인 2743억 원을 납부하지 못한 데다 감사인으로부터 기업의 존속 능력에 불확실성을 제기했고 상장폐지 여부도 기다려야 하는 만큼 넘어야 할 산이 많다""고 말했다.발로 뛰는 더팩트는 24시간 여러분의 제보를 기다립니다.▶카카오톡: '더팩트제보' 검색▶이메일: jebo@tf.co.kr▶뉴스 홈페이지: http://talk.tf.co.kr/bbs/report/write",-1
20220331,목,카카오,"에스엠 본사[이데일리 김윤지 기자] 에스엠(041510)의 감사 선임 안건을 두고 최대주주인 이수만 총괄 프로듀서와 행동주의 펀드 얼라인파트너스자산운용이 표 대결을 펼친 가운데 얼라인 측이 승리를 거두자 지배구조 개선 기대감에 상승 중이다.31일 마켓포인트에 따르면 이날 오전 11시 52분 기준 에스엠은 전거래일 대비 4200원(5.28%) 오른 8만3800원에 거래 중이다.이날 에스엠은 예정보다 2시간 넘게 늦어진 정기 주주총회에서 곽준호 SK넥실리스 전 최고재무책임자(CFO)를 감사로 선임했다. 곽 전 CFO는 얼라인 측의 주주 제안이었다. 감사 선임의 건을 두고 이사회가 추천한 임기영 한라그룹 비상근 고문은 자진 사퇴했다.앞서 얼라인 측은 에스엠이 뛰어난 사업 성과에도 거버넌스의 아쉬움으로 저평가되고 있다며 이사회가 제 역할을 하기 위해서는 외부 주주가 추천한 독립적인 감사 선임이 필요하다며 주주제안했다. 특히 이수만 최대주주 개인회사인 라이크기획과의 프로듀싱 용역 계약을 지적하며, 하이브(352820), JYP Ent.(035900) 등 동종업계 사례를 참고해 합리적 대안을 제시해 달라고 에스엠 이사회에 공개 주주서한을 보냈다. 라이크기획은 3년전 KB자산운용이 주주서한을 통해 문제 삼았던 부분이기도 하다.양 측은 표심을 두고 팽팽한 신경전도 펼쳤다. 에스엠은 우호 지분을 확보할 수 있는 안건을 기습적으로 추가했다가 일부 철회하는 등 경영권 방어에 총력을 기울이는가 하면, 기관이 의결권을 위임할 경우 걸그룹 에스파 카리나의 친필 사인을 증정한 것으로 알려졌다. 얼라인 측 또한 카카오엔터테인먼트의 지분 인수 등 각종 입장문을 발표하며 독립적 감사 선임의 중요성을 강조해 의결권 위임 촉구했다.",0
20220331,목,카카오,"주주 위임장 집계로 2시간 지각 주총에스엠 본사[이데일리 김윤지 기자] 에스엠(041510)의 감사 선임 안건을 두고 최대주주인 이수만 총괄 프로듀서와 행동주의 펀드 얼라인파트너스자산운용이 표 대결을 펼친 가운데 얼라인 측이 승리를 거뒀다.에스엠은 31일 예정보다 2시간 넘게 늦어진 정기 주주총회에서 곽준호 SK넥실리스 전 최고재무책임자(CFO)를 감사로 선임했다. 곽 전 CFO는 얼라인 측의 주주 제안이었다. 감사 선임의 건을 두고 이사회가 추천한 임기영 한라그룹 비상근 고문은 자진 사퇴했다.앞서 얼라인 측은 에스엠이 뛰어난 사업 성과에도 거버넌스의 아쉬움으로 저평가되고 있다며 이사회가 제 역할을 하기 위해서는 외부 주주가 추천한 독립적인 감사 선임이 필요하다며 주주제안했다. 특히 이수만 최대주주 개인회사인 라이크기획과의 프로듀싱 용역 계약을 지적하며, 하이브(352820), JYP Ent.(035900) 등 동종업계 사례를 참고해 합리적 대안을 제시해 달라고 에스엠 이사회에 공개 주주서한을 보냈다. 라이크기획은 3년전 KB자산운용이 주주서한을 통해 문제 삼았던 부분이기도 하다.양 측은 표심을 두고 팽팽한 신경전도 펼쳤다. 에스엠은 우호 지분을 확보할 수 있는 안건을 기습적으로 추가했다가 일부 철회하는 등 경영권 방어에 총력을 기울이는가 하면, 기관이 의결권을 위임할 경우 걸그룹 에스파 카리나의 친필 사인을 증정한 것으로 알려졌다. 얼라인 측 또한 카카오엔터테인먼트의 지분 인수 등 각종 입장문을 발표하며 독립적 감사 선임의 중요성을 강조해 의결권 위임 촉구했다.",0
