date,day,word,text,label
20220331,목,카카오,"[머니S리포트 안갯속 증시 대피처는?]②윤석열 3대 수혜주 부각[편집자주]올들어 미국 중앙은행인 연방준비제도(연준·Fed)가 긴축 움직임을 본격화하며 국내 증시가 적잖은 충격을 받고 있다. 연준의 급격한 긴축 우려로 글로벌 증시 전체가 흔들리고 있는 가운데 러시아와 우크라이나를 둘러싼 지정학적 긴장감이 국내 증시의 불안정성을 키우는 요인으로 작용하기도 했다. 투자자들은 안갯속 증시 대피처 찾기에 분주하다. 새 정부 출범 후 수혜 업종을 찾는가 하면 코로나 엔데믹화로 인한 리오프닝(경제 재개) 수혜주 찾기에 열을 올린다. 하반기 증시를 전망하고 투자 대피처를 들여다봤다.◆기사 게재 순서①""대장주인데 주가가 왜 이래"" 하반기 증시 전망은?②원전·건설·플랫폼주?… 윤석열 수혜주 뭐 있나③여행·카지노주 '드릉드릉'… 리오프닝 관련주 기대감 UP윤석열 국민의힘 대선후보가 제20대 대통령에 당선되면서 주식시장에서는 수혜주 찾기가 한창이다. 윤 당선인의 공약과 관련해 ▲원전 ▲건설 ▲플랫폼 관련주가 핵심 수혜산업으로 관심을 받으면서 관련 종목의 주가가 연일 상승세를 나타내고 있다. 윤 당선인 공약은 대부분 문재인 정부 정책을 뒤집고 규제를 완화하는데 집중됐다는 점에서 ‘규제완화 수혜주’가 곧 윤석열 대통령 시대 수혜주로 주목받고 있다. 때문에 문 정부 내내 규제로 주가가 부진했던 대표 업종인 건설과 원자력발전 관련주, 플랫폼 기업 주가는 대선 이후 연일 상승 중이다.날개 단 원전주, 尹 “탈원전 정책 전면 폐지” 대표 수혜주 윤석열 정부 출범을 앞두고 문재인 정부의 탈원전 정책은 백지화 수순을 밟게 되면서 원전주들의 주가가 연일 들썩이고 있다. 윤 당선인은 취임 이후 원자력의 발전비중 30%대 유지와 원전 산업 육성을 위해 신한울 3·4호기의 공사 재개, 월성 1호기 재가동 검토, 소형모듈원자로(SMR) 개발 등을 구체화할 전망이다.2월 초 1만7950원에 거래되던 두산중공업의 주가는 지난 3월22일 기준 2만1700원까지 뛰며 17% 상승했다. 두산중공업은 국내에서 유일하게 발전용 원자로 제작 능력을 지니고 있으며, 차세대 원전으로 꼽히는 소형모듈원전(SMR)과 신재생에너지 사업을 적극 육성 중이다. 이외에도 한신기계(37.48%) 보성파워텍(16.58%) 우리기술(15.49%) 우진(8%) 등 다른 원전 관련 종목들도 대선 이후 줄곧 상승랠리를 이어가고 있다. 증권가에서는 탈원전 기조의 전면 수정이 불가피하다는 점에서 원전 관련 업종에 긍정적일 것으로 내다봤다.안영진 SK증권 연구원은 “새로운 정부의 친원전 정책으로 인해 신한울 3·4호기 건설이 재개될 전망”이라며 “윤 당선인이 임기 대 설계 수명이 만료되는 원전들의 사용을 연장할 가능성이 높은데 이는 원전 관련주의 수익성을 장기적으로 개선할 정책 변화”라고 말했다.상승랠리 올라탄 건설株… 증권가 건설업 ‘비중확대’ 의견도서울 송파구 롯데월드타워 서울스카이에서 바라본 아파트 단지/사진=뉴스1대선 이후 재건축·재개발 규제 완화 기대감으로 건설사들의 주가도 활기를 나타내고 있다. 시장에서는 건설업종에 대해 밸류에이션 부담이 없는 만큼 저평가돼 있어 반등 모멘텀을 잡을 것으로 전망했다.한국거래소에 따르면 지난 3월22일 기준 KRX 건설업 지수는 697.59로 한 달 전과 비교하면 9% 올랐다. 같은 기간 건설업 대표주인 현대건설은 13.05% 올랐고, GS건설(12.95%) 대우건설(19.51%) DL이앤씨(5.79%) 등 이달 들어 연일 상승 흐름이 이어졌다.GS건설과 현대건설은 각각 자이(Xi)와 힐스테이트, 디에이치라는 프리미엄 아파트 브랜드를 보유해 강남 재건축 시장에서 압도적인 경쟁력을 가졌다. 양사는 지난해 기준 분양 물량이 각각 2.7만 세대, 4만세대로 시장점유율 3위와 1위를 기록했다. 올해 분양 예정 세대도 각각 2.3만세대, 5.3만세대에 달한다.KRX건설업 지수는 693.13으로 올해 첫 거래를 시작했으나 지난 1월 말 HDC현대산업개발의 광주 화정동 아파트 외벽 붕괴사고로 585.42까지 추락했다. 이후 바닥을 다지고 반등했지만, 지난 달 말까지 650대 이하에 눌려 있었다. 이후 3월 초 688.44로 올라선 뒤 대선 직후 700대를 찍고 최근 숨고르기에 들어가며 재돌파 기회를 엿보고 있다.증권가에선 건설업종에 대한 투자의견을 ‘비중확대’로 제시하며 향후 성장 가시성을 높게 평가하고 있다. 다올투자증권(구 KTB투자증권) 라진성 연구원은 “시장에 우호적인 부동산 공약으로 주택 중심 건설사들이 부각되고, 해외 중심의 건설사의 주가는 부진한 상황”이라면서도 “해외 중심 건설사의 탄탄한 해외 파이프라인과 견고한 실적이 예상되고 있다”며 “주가 조정 시 비중확대 전략은 유효하다고 판단된다”고 말했다.“규제완화로 숨통 트일까” 기관, 네이버·카카오 연일 순매수 작년 말부터 규제 리스크에 위축된 NAVER와 카카오도 플랫폼 규제 완화 수혜주로 주목받고 있다. 친기업 성향으로 분류되는 윤석열 국민의힘 후보가 대통령에 당선되면서 플랫폼 기업에 대한 규제가 완화될 것이라는 기대감에 네이버와 카카오는 급반등했다.한국거래소에 따르면 규제 리스크에 움츠러들어 있던 네이버와 카카오는 지난 3월9일 대선 이후 22일까지 각각 11.49%, 15.63% 급등했다. 카카오의 투자자별 거래실적을 살펴보면 대선 다음날인 10일부터 22일까지 기관과 외국인은 각각 1139억원, 2355억원어치 주식을 사들였다. 반면 개인은 3446억원어치를 팔아치웠다. 같은 기간 네이버에선 기관 홀로 1831억원어치 주식을 순매수했지만 외국인과 개인은 425억원 ,각각 1402억원 순매도했다. 기관들은 오는 5월 출범하는 윤석열 정부가 문재인 정부와는 반대로 온라인 플랫폼 업체에 대한 규제를 대폭 완화할 것으로 기대하며 순매수에 나선 것으로 풀이된다. 반면 그동안 부진한 주가 흐름을 보이던 네이버와 카카오 주가가 모처럼 반등에 성공하자 개인들은 가지고 있던 물량을 던지며 차익실현에 나선 것으로 보인다.증권가에서도 20대 대선이 끝나고 플랫폼 산업에 대한 우호적인 환경이 조성될 가능성이 제기되고 있다. 산업 성장, 실적 상승 등 긍정적 여건을 고려하면 주가는 반등을 모색할 것이란 분석이 나온다.정호윤 한국투자증권 연구원도 “규제 리스크가 불거졌던 플랫폼 산업에 관해 윤석열 당선인은 직접적인 규제보다 업계의 자율적인 자정노력을 촉진시키는 것이 핵심 방향성”이라며 “이로 인해 플랫폼 산업의 리스크가 줄어들 것으로 전망한다”고 말했다.",0
20220331,목,카카오,"기사내용 요약넷마블 'A3: 스틸얼라이브' 글로벌 서비스 시작컴투스 대형 IP '서머너즈 워: 백년전쟁' 기대감네오위즈 '크립토 골프 임팩트' 4월 출시 예정[서울=뉴시스] 오동현 기자 = 넷마블, 컴투스, 네오위즈가 이른바 돈 버는 게임 'P2E(Play to Earn)' 라인업을 앞세워 본격적인 글로벌 시장 개척에 나선다.30일 게임 업계에 따르면 3사는 자체 블록체인 플랫폼 내에서 기축통화 역할을 할 가상자산을 만들고, 타사 게임 라인업까지 서비스하는 것을 목표로 생태계를 확장하고 있다.3사 모두 한국을 제외한 글로벌 P2E 시장을 겨냥한다. 국내에선 P2E가 사행성 논란으로 서비스가 불가능해서다. 실제 게임물관리위원회는 국내에서 서비스 중이던 P2E 게임 '무한돌파삼국지 리버스'의 등급분류 취소 결정을 내린 바 있다.넷마블·컴투스·네오위즈, 4월부터 P2E 물량 공세…글로벌 시장서 통할까넷마블은 MBX 블록체인 생태계를 공개하고 첫 P2E 게임 'A3: 스틸얼라이브'의 글로벌 서비스를 시작했다. 이어 4월 출시 예정인 '골든브로스'를 비롯해 '제2의 나라', '몬스터 길들이기 아레나', '모두의 마블: 메타월드', '챔피언스: 어센션' 등을 차례로 선보일 계획이다. 게임 내에서 기축통화 역할을 하는 토큰 이름도 MBX다.'A3: 스틸얼라이브'는 지난 2002년 PC온라인게임으로 출시된 넷마블 자체 IP(지적재산권) 'A3'를 모바일 MMORPG(대규모 다중 접속 역할수행 게임)로 재해석한 게임이다. 지난해 3월 국내에 출시됐고, 최근 블록체인 기술과 연계한 P2E 게임으로 탈바꿈해 글로벌 시장에 도전장을 내밀었다.개발사 넷마블 엔투의 권민관 대표는 지난 1월 P3E 게임 계획을 발표할 당시 ""A3는 분쟁 요소가 강해서 승리한 자가 재화를 가져가는 구조다. 블록체인과 연계되면 분쟁이 강화되고 게임이 더 재밌어질 것이다. 블록체인 생태계 활성화 측면에서도 도움이 많이 될 것""이라고 자신했다.특히 넷마블은 태생적으로 안고 있던 자체 IP 부족의 한계를 극복하기 위해 신작 라인업 15종을 공개하고, 이 가운데 상당수를 블록체인과 연계해 출시하는 방안을 검토하고 있다. 글로벌 P2E 시장에서 자체 IP의 경쟁력을 입증하고 국내를 넘어 글로벌 게임사로 한 단계 도약을 꿈꾸고 있다.권영식 넷마블 대표는 최근 주주총회에서 ""넷마블의 또 한번의 진화와 재도약을 위해 블록체인과 메타버스 등 관련 차세대 기술 확보와 연구 개발에 큰 공을 들여왔다""며 ""올해를 기점으로 블록체인 기술 기반의 다양한 신작을 순차적으로 선보일 것""이라고 말했다.컴투스 그룹은 C2X 블록체인 생태계 기반의 P2E 게임을 4월부터 순차적으로 출시할 예정이다. 특히 누적 매출 2조 7000억 원, 1억 3000만 다운로드, 전 세계 90개국 1위를 기록한 '서머너즈워: 천공의 아레나'라는 강력한 IP를 기반으로 글로벌 시장을 공략한다. 가장 먼저 출시될 P2E 게임은 실시간 전략 장르의 '서머너즈 워: 백년전쟁'이다. 신작 MMORPG '서머너즈 워: 크로니클'은 올 하반기 출시 예정이다.이 외에도 ▲수집형 RPG '크로매틱소울: AFK 레이드' 4월 ▲레이싱게임 '마블 레이스(가칭)' 2분기 ▲수집형 RPG '안녕엘라' 2분기 ▲캐주얼 RPG '프로젝트 알케미스트(가칭)' 2분기 ▲MMORPG 'DK모바일: 영웅의 귀환' 상반기 ▲수집형 RPG '더 워킹 데드: 올스타즈(가칭)' 3분기 ▲스포츠 장르 '크립토 슈퍼스타즈' 3분기 예정 ▲MMORPG '월드 오브 제노니아' 하반기 ▲'낚시의 신: 크로' 하반기 ▲'골프스타 챔피언십' 하반기 ▲방치형 RPG '사신키우기' 하반기 ▲MMORPG '거상M 징비록' 내년 상반기 출시를 예고하고 있다.네오위즈홀딩스의 블록체인 전문 자회사 네오플라이는 지난 2월 가상자산 지갑, P&E(P2E), S2E(Service to Earn, 돈 버는 서비스), NFT(대체 불가능 토큰) 등을 아우르는 블록체인 오픈플랫폼 네오핀을 출시했다. 플랫폼에서 사용되는 가상자산은 '네오핀 토큰(NPT)'이다.이어 네오위즈는 카카오 클레이튼 네트워크 기반의 P&E 게임 3종 '크립토 골프 임팩트', '브레이브나인(BRAVE NINE)', '아바(A.V.A)'를 글로벌 서비스 예정이다.'크립토 골프 임팩트'는 스포츠 모바일 게임 ‘골프 임팩트’에 블록체인 기술을 적용한 게임으로 4월 정식 출시 예정이다. 이 게임은 다양한 세계 명소를 배경으로 간편한 조작을 통해 이용자들과 실시간 PVP(이용자간 대결)를 즐길 수 있는 것이 특징이다. '브레이브 나인'은 '브라운더스트'의 글로벌 서비스 명칭이며, 글로벌 신규 서버 추가와 함께 서비스를 시작할 예정이다.국내 게임사 중 가장 빨리 글로벌 P2E 시장을 공략하고 있는 곳은 위메이드다. 위메이드의 모바일 MMORPG '미르4' 글로벌은 동시 접속자 130만을 돌파하는 등 P2E 시장에 새로운 역사를 쓰고 있다. 현재 아시아, 유럽, 남미, 북미, 인도, 북아프리카/중동 권역에서 207개 총서버에서 서비스 중이다. 스팀에서도 동시접속자 수가 10만명에 육박한다.게임업계 관계자는 ""P2E는 게임을 즐기며 획득한 재화나 아이템을 가상자산(토큰)으로 전환해 수익도 창출할 수 있어서, 많은 국내외 게임사들이 블록체인 기반 게임을 준비하고 고민하고 있다""며 ""한국에선 규제로 인해 서비스가 불가능해 안타깝지만, 한국 게임이 글로벌 시장에서 더욱 위상을 높일 기회로 보고 있다""고 말했다．",0
20220331,목,카카오,"얼라인 측 “지배구조 탓에 저평가”KB운용 이어 라이크기획 문제 삼아‘3%룰’ 변수되나…자문사는 얼라인 ‘손’[이데일리 김윤지 기자] 에스엠(041510)의 감사 선임 안건을 두고 최대주주인 이수만 총괄 프로듀서와 행동주의 펀드 얼라인파트너스자산운용이 오늘(31일) 표 대결을 펼친다.에스엠은 이날 정기 주주총회를 열고 재무제표 승인과 사외이사 선임, 감사 선임, 이사 보수한도 승인, 감사보수한도 승인, 사내이사 선임 안건을 의결한다. 이중 감사 선임의 건을 두고 이사회는 임기영 한라그룹 비상근 고문을 추천하고, 얼라인 측은 주주로서 곽준호 케이씨에프테크놀러지스(현 SK넥실리스) 전 최고재무책임자(CFO)를 제안했다.이수만 SM엔터테인먼트 총괄 프로듀서.(사진=에스엠)얼라인은 에스엠이 뛰어난 사업 성과에도 거버넌스의 아쉬움으로 저평가되고 있다며 이사회가 제 역할을 하기 위해서는 외부 주주가 추천한 독립적인 감사 선임이 필요하다는 입장이다. 특히 이수만 최대주주 개인회사인 라이크기획과의 프로듀싱 용역 계약을 지적하며, 하이브(352820), Jyp Ent. 등 동종업계 사례를 참고해서 합리적 대안을 제시해 달라고 에스엠 이사회에 공개 주주서한을 보내기도 했다. 라이크기획은 이미 지난 2019년 KB자산운용이 주주서한을 통해 문제 삼았던 부분이기도 하다.에스엠 측은 주주서한에 대해 지난 24일 “얼라인 측의 의견을 존중하며 의미 역시 이해하고 있다”면서도 “회사의 대내외적 경영 환경 변화 등이 있을 수 있어 현재로서는 구체적 회신을 드리기 어렵다”고 답변했다.아티스트 사인도 등장…“소액 주주에 달려”업계는 소액 주주들의 표심에 결과가 달린 것으로 보고 있다. 지분율만 보면 사측 우호 지분이 압도적이다. 이수만 총괄 프로듀서의 지분 18.48%를 포함해 특수관계인 지분이 19.17%에 달한다. 국민연금공단이 6.15%, KB자산운용이 5.13%를 쥐고 있다. 얼라인와 특수관계자의 지분율은 0.91%로, 주주 위임 등을 통해 이번 주총에서 3% 이상 의결권을 행사할 수 있는 것으로 알려졌다. 하지만 감사위원이 되는 1인 이상의 이사를 다른 이사들과 분리 선임하도록 하고, 이때 최대주주와 특수관계인의 의결권이 3%로 제한하는 이른바 ‘3%룰’로 사측은 승리를 장담할 수 없는 상황이다. 해외 의결권 자문사인 ISS와 한국기업지배구조원(KCGS) 등 국내 의결권 자문사 등은 얼라인의 주주제안에 찬성을 권고한 것으로 알려졌다.때문에 양 측은 표심을 두고 팽팽한 신경전을 펼쳤다. 에스엠은 우호 지분을 확보할 수 있는 안건을 기습적으로 추가했다가 일부 철회하는 등 경영권 방어에 총력을 기울이는가 하면, 기관이 의결권을 위임할 경우 걸그룹 에스파 카리나의 친필 사인을 증정한 것으로 알려졌다. 얼라인 측 또한 카카오엔터테인먼트의 지분 인수 등 각종 입장문을 발표하며 독립적 감사 선임의 중요성을 강조해 의결권 위임 촉구했다. .",0
20220331,목,카카오,"브랜드스탁, 1분기 100대 브랜드 순위 발표대한항공, 보잉737-8 1호기 도입(서울=연합뉴스) 지난 13일 대한항공 보잉 737-8 항공기 1호기가 김포공항에 착륙하고 있다. 대한항공에 따르면 이번에 도입된 보잉사의 737-8 1호기는 감항성 검사 등을 거친 후 다음 달 1일부터 운항에 들어갈 예정이다. 2022.2.14[대한항공 제공. 재판매 및 DB 금지] photo@yna.co.kr(서울=연합뉴스) 조재영 기자 = 해외여행 재개 기대감에 대한항공, 하나투어 등의 브랜드가치가 급등한 것으로 나타났다.브랜드가치 평가회사인 브랜드스탁은 올해 1분기 100대 브랜드 평가 결과 대한항공은 브랜드스탁의 브랜드가치 평가지수인 BSTI(BrandStock Top Index) 886.8점을 얻어 지난 분기 22위에서 11위로 뛰어올랐다고 31일 밝혔다.대한항공은 코로나19 여파로 2020년 1분기에 순위가 50위로 급락한 이후 2분기 54위, 3분기 58위까지 하락했었다.그러나 최근 해외여행 재개에 따른 기대감과 아시아나항공과의 합병 및 실적 개선 등의 영향으로 상승세로 돌아선 것으로 분석된다.격리 면제 후 여행수요 폭발(서울=연합뉴스) 김주성 기자 = 28일 오후 서울 종로구 하나투어 본사에서 마케팅기획팀 직원들이 최근 해외 입국자의 자가격리 의무 면제 이후 급증한 여행수요에 맞춰 사전예약할인 프로모션 등 다양한 상품을 내놓기 위해 기획 회의를 하고 있다. 2022.3.28 utzza@yna.co.kr여행사 1등 브랜드인 하나투어는 지난해 종합 40위까지 처졌으나 이번 분기에 7계단 상승하며 33위에 랭크됐다.브랜드스탁 관계자는 ""코로나19 직격탄을 맞은 대표 업종인 항공과 여행 브랜드들은 최근 시행된 해외 입국자 격리 면제 정책에 따라 여행 수요가 본격적으로 살아날 것으로 기대되고 있어 브랜드가치가 빠르게 회복세를 보인다""고 분석했다.동영상 플랫폼 유튜브는 이번 분기에 10위까지 오르며 최근 10년 동안 가장 빠르게 톱10에 진입한 브랜드로 자리매김했다.유튜브는 2020년 3분기에 33위로 처음 순위에 오른 이후 1년 6개월 만에 상위 10위권에 포함됐다.온라인 쇼핑 쿠팡은 전분기 11위에서 이번 분기 13위로 떨어졌다.쿠팡은 지난해 22조원의 최대 매출 실적을 냈지만, 1조8천600억원 가량의 순손실을 내 수익성 개선이 시급한 과제로 꼽히고 있다.삼성전자의 스마트폰 브랜드인 삼성 갤럭시는 이번 분기에도 BSTI 935.1점을 얻으며 전체 1위를 유지했다.갤럭시는 11년째 국내 브랜드 1위 자리를 지키고 있다.카카오톡은 전분기에 이어 2위를 지켰으며 네이버와 KB국민은행도 변동 없이 3위와 4위에 각각 랭크됐다.이밖에 신한카드, 롯데월드 어드벤처, 신라면, 구글, 이마트 등이 상위 10위권에 포함됐다.이번 분기에 새로 진입한 브랜드는 중고나라(80위), 마켓컬리(82위), 한샘(85위), 테슬라(89위), 배달의민족(91위), 라네즈(98위), 롯데슈퍼(100위) 등 총 7개다.대한민국 100대 브랜드는 BSTI 점수가 높은 브랜드를 상위 100위까지 선정해 발표하는 국내 유일의 브랜드 가치 평가 인증제도다.총 230여개 부문의 대표 브랜드 1천여개를 대상으로 브랜드스탁 증권거래소의 모의 주식 거래를 통해 형성된 브랜드주가지수(70%)와 정기 소비자조사지수(30%)를 결합한 브랜드가치 평가모델로 점수를 산정한다. 만점은 1천점이다.fusionjc@yna.co.kr",0
20220331,목,카카오,"올해 자사주 직접처분 시행 종목 7개하락장에 자사주 처분 업체 전년비 절반 감소카카오 등 대형사들, 잇단 자사주 처분 결정임직원 스톡옥션 부여 및 상여금 제공 목적소액주주들 주주가치 하락 우려에 불만 고조전문가들 ""장기적 기업성장에 기여""[이데일리 김응태 기자] 국내 증시가 박스권에 갇힌 가운데 소액주주들이 자사주를 처분하는 대형 상장사에 눈총을 주고 있다. 자사주 처분 시 시중에 유통되는 주식이 늘어나 기존 주주가치가 희석될 여지가 있기 때문이다. 반면 기업들은 우수 인재에 스톡옵션 등을 지급하기 위해선 자사주 처분을 감행할 수밖에 없다는 입장이다.30일 한국거래소에 따르면 올해 들어 자사주를 직접 처분(신탁계약 제외)한 상장사는 7곳으로 집계됐다. 지난해 같은 기간 18곳이 처분을 실행한 것과 비교하면 절반 넘게 줄었다.[이데일리 김정훈 기자]경기 둔화에 자사주 처분 줄었는데…카카오는 처분 결정특히 일부 대형주들이 자사주 처분에 잇따라 나서면서 주주들이 비판의 화살을 보내고 있다. 카카오(035720)가 대표적이다. 카카오는 올해에 들어 세 번에 걸쳐 대규모 자사주 처분 결정을 공지했다. 이달 29일에는 102억원 규모의 자사주 처분을 결정했다. 처분 주식수는 9만7761주이다. 카카오는 지난달 10일과 24일에도 각각 1억7186만원, 3269만원 규모의 자사주 처분 결정을 내렸다. 처분주식수는 10일 1996주, 24일 353주였다.아모레퍼시픽(090430)도 올해 들어 2번에 걸쳐 자사주 처분을 확정했다. 이달 24일에는 7억6075만원, 지난달 9일에는 3792만원 규모의 자사주를 처분하겠다고 밝혔다. 처분예정 주식수는 각각 4861주, 240주다.SK(034730)도 이달 3일 78억2948억원 규모, 3만3531주의 자사주 처분 결정을 알렸다. 네이버도 이달 2일 267억원 규모의 자사주 처분 결정을 공시했다. 처분 주식수는 14만3577주에 달했다.자사주 처분 결정 후 주가 하락세…주주가치 희석 우려이처럼 대형 상장사들이 연이어 자사주 처분에 돌입하자 주주들은 “자사주 소각도 아닌 처분이 웬 말이냐”며 볼멘소리를 내고 있다. 이미 글로벌 경기 둔화를 비롯해 지정학적 리스크로 증시가 하락 국면에 접어든 상황에서 자사주 처분으로 유통 물량이 늘어나면 기존 주주들은 가치가 희석되는 피해를 볼 수밖에 없기 때문이다.실제 자사주 처분 결정 공시를 낸 당일 주가는 하락세 보이는 경우가 대다수였다. 아모레퍼시픽의 이달 24일 종가는 15만5500원으로 전 거래일 대비 0.64% 하락했다. SK도 지난 3일 주가는 23만2500원으로 전날 대비 0.43% 내려갔다. 네이버 역시 지난 2일 주가는 31만7000원으로 전날보다 0.31% 빠졌다. 반면 카카오의 경우 이달 29일 자사주 처분 결정 후 주가는 10만5500원으로 전 거래일 대비 0.48% 소폭 상승했다.업체들 “우수인재 확보 목적”…전문가들 “장기적 이점 봐야”이 같은 주가 흐름에도 업체들이 자사주를 처분하는 것은 경쟁 업체로 우수 인재가 이탈하는 것을 미연에 방지하기 위해서다. 업체들은 일제히 자사주 처분을 통해 마련한 자금으로 임직원 대상으로 스톡옵션 및 상여를 지급하겠다고 설명했다.전문가들도 자사주 처분이 호재는 아니어도 장기적으로는 기업의 펀더멘털 개선에 기여할 수 있다고 봤다. 유망한 인재를 보유해야 기업의 성장이 가능하다는 판단에서다. 김민기 자본시장연구원 연구위원은 “자사주 처분이 주주가치를 희석하는 효과가 없지 않다”면서도 “임직원들이 열심히 일해서 자기들이 스톡옵션을 갖고 있으면 보상도 커지고 결국에는 주주가치도 일치하는 방향으로 가게 돼 스톡옵션의 긍정적 기능이 있다”고 말했다.",0
