date,day,word,text
20220329,화,쌍용차,"[서울경제]<유가증권>▲태영건설(009410)=한강그룹 대전지사에 300억 원 규모 채무보증 결정 ▲삼성바이오로직스(207940)=IFEZ로부터 4260억 원 규모 송도국제도시 첨단산업클러스터 부지 취득 결정, 계열사 삼성전자(8821억 원)와 삼성물산(1조 2168억 원)이 구주주 배정 증자 참여 ▲에스디바이오센서(137310)=충북 증평에 1880억 원 규모 설비 투자 ▲쌍용차(003620)=관계인 집회기일 결정 취소 ▲SK이노베이션(096770)=자회사 SK(034730)온이 단기 차입금 2조 2200억 원 증가 결정 ▲효성첨단소재(298050)=베트남 계열사에 147억 원 규모 채무보증 결정 ▲화성산업(002460)=의결권 행사 금지 가처분(원고 이인중) 소 기각 ▲SK=자사주 24만 500주 처분 결정 ▲동아지질=손해배상 청구(원고 이화글로텍 외 4명) 소 금전 지급 판결 ▲다우기술(023590)=계열사 키움이앤에스에 328억 원 출자 결정 ▲DSR제강(069730)=홍하종·홍석빈 각자 대표이사로 변경 ▲AJ네트웍스(095570)=박대현·손삼달 각자 대표로 변경 ▲이건산업(008250)=이길수·박승준 대표이사로 변경 ▲케이씨(029460)=고상걸·임관택 각자 대표로 변경 ▲두산(000150)=박정원·김민철·문홍성 대표이사로 변경 ▲신세계인터내셔날(031430)=이길한 대표이사로 변경 ▲JW중외제약(001060)=신영섭 대표이사로 변경 ▲SK디스커버리(006120)=최창원·안재현 대표이사로 변경 ▲삼양통상(002170)=허남각·허준용 각자 대표이사로 변경 ▲LS(006260)=명노현 대표이사 신규 선임 ▲현대엘리베이(017800)터=조재천 대표이사 신규 선임 ▲HDC현대산업개발(294870)=유병규·정익희·하원기 각자 대표이사로 변경 <29일><코스닥>▲마이더스AI(222810)=종속사 케이나노피아가 보통주 1198만 5600주 감자 결정 ▲오픈베이스(049480)=자사주 12만 1108주 처분 결정 ▲바이오리더스(142760)=자궁경부전암 치료제 유효성 확증을 위해 2상 임상 시험 및 연장 연구 신청 ▲세원물산(024830)=미국 계열사에 123억 원 규모 채무보증 결정 ▲세원(234100)=폴라리스세원으로 상호 변경 ▲오스템임플란트(048260)=메리츠증권과 최대주주 변경을 수반하는 담보 계약 체결 ▲씨유테크(376290)=라비닉스 주식 13만 8000주 취득 결정 ▲모아데이타(288980)=영문 상호 표기 정정 ▲옵트론텍(082210)=제이월드 주식 200억 원 규모 처분 결정 ▲정산애강(022220)=티케이지애강으로 상호 변경 ▲아이즈비전(031310)=김상우·최순종 각자 대표이사로 변경 ▲경동제약(011040)=류기성·김경훈 각자 대표이사로 변경 ▲셀루메드(049180)=유인수 대표이사로 변경 ▲이엔코퍼레이션(066980)=오태석·박종운 각자 대표이사로 변경 ▲삼기(122350)=김치환·이동원 각자 대표이사로 변경 ▲에코프로에이치엔(383310)=김종섭 대표이사 신규 선임 ▲솔브레인홀딩스(036830)=정현석 대표이사 선임 ▲선익시스템(171090)=박재규·김혜동 대표이사로 변경 ▲CJ ENM(035760)=강호성·윤상현 대표이사로 변경 ▲메디프론(065650)=김상우 단독 대표이사로 변경 ▲코윈테크(282880)=정갑용 대표이사 신규 선임 ▲인콘(083640)=최영훈·김성곤 대표이사로 변경 ▲파워넷(037030)=김상우·이돈주 대표이사로 변경 ▲핌스(347770)=김민용 대표이사 신규 선임 ▲제넥신(095700)=우정원, Neil Warma 대표이사로 변경 ▲한일단조(024740)=박정영 대표이사 신규 선임 ▲남화토건(091590)=최재훈 단독 대표이사로 변경 ▲삼천당제약(000250)=전익석 대표이사로 변경 ▲톱텍(108230)=정지용 대표이사 신규 선임 ▲나노스(151910)=홍진의 대표이사 신규 선임 ▲하림=김홍국·정호석 각자 대표이사로 변경 ▲동방선기(099410)=손지익 대표이사로 변경 ▲스튜디오드래곤(253450)=김제현·김영규 대표이사로 변경 ▲제넨바이오(072520)=김성주·김춘학 대표이사로 변경 ▲오스템(031510)=김정우·김동효 각자 대표이사로 변경 <29일>"
20220329,화,쌍용차,ⓒ에디슨EV[데일리안 = 이충재 기자] 한국거래소 코스닥시장본부는 29일 에디슨EV에 감사의견 비적정설의 사실 여부와 구체적 내용을 확인하기 위한 조회공시를 요구하고 이 종목의 주권 매매 거래를 정지했다. 답변시한은 30일 오후 6시까지다.앞서 에디슨모터스 컨소시엄의 쌍용차 인수가 무산되면서 에디슨EV 주가는 급락했다. 쌍용차는 전날 에디슨모터스 컨소시엄과의 인수합병(M&A) 계약을 공식적으로 해제한다고 밝혔다.에디슨모터스 측은 정용원 쌍용차 관리인과 매각주관사인 EY한영회계법인에 관계인 집회 일정 연기를 요청했지만 받아들여지지 않았다. 에디슨모터스는 계약 해지에 반발하며 서울회생법원에 계약자 지위보전 가처분 신청을 낼 것이라고 밝혔다.
20220329,화,쌍용차,"""에디슨EV, 감사의견 비적정설""…시간외 하한가 수준에서 거래 정지에디슨모터스 ""효력정지 가처분신청 접수"" 소식에 외국인·개인 순매수쌍용자동차는 28일 ""에디슨모터스 컨소시엄(이하 인수인)이 투자계약에서 정한 잔여 인수 대금 예치의무를 이행하지 못함에 따라 'M&A를 위한 투자계약'이 해제됐다＂고 밝혔다. 사진은 이날 오후 경기 평택시 쌍용자동차 평택공장의 모습. 2022.3.28/뉴스1 © News1 김영운 기자(서울=뉴스1) 손엄지 기자,강은성 기자 = 쌍용자동차 인수 대금을 내지 못해 투자계약이 무산된 에디슨모터스 자회사 에디슨EV의 주가가 하루동안 천당과 지옥을 오갔다. 결국 한국거래소로부터 '감사의견 비적정설 조회공시 요구'를 받으며 거래가 정지됐다.29일 에디슨EV는 전일대비 650원(-5.31%) 하락한 1만1600원에 거래를 마쳤다. 장 초반 이틀 연속 하한가에 근접한 8720원까지 하락했다가 오후들어 상한가 수준인 1만4900원까지 상승하는 등 급등락했다.이에 한국거래소는 오후 5시9분쯤 에디슨EV에 감사의견 비적정설에 대한 사실 여부와 구체적인 내용을 답변하라고 공시하면서 거래를 정지시켰다. 에디슨EV는 시간외 단일가 거래에서 하한가 수준인 1만950원까지 하락했고, 오후 5시 거래가 멈췄다. 하한가 매도 물량이 쏟아져 나왔지만 체결되지 못했다.한 금융투자업계 관계자는 ""거래소의 감사의견 비적정설 확인 공시는 사실상 회계법인의 확인을 거쳤기 때문에 가능성이 크다고 봐야한다""면서 ""감사의견 거절까지 나오면 거래정지 기간이 길어질 수 있고, 쌍용차 인수에도 차질이 생길 것으로 보인다""고 말했다.에디슨EV는 전날 쌍용차 인수 가능성을 보고 에디슨EV에 투자한 개인투자자들의 매물이 쏟아져 나오면서 하한가를 기록했다. 이날도 이틀 연속 하한가 가능성이 커졌는데 오후들어 에디슨모터스가 ""전날 쌍용차 법정 관리인의 일방적인 계약해제 통지에 이의를 제기하며 법원에 (계약해제)효력정지 등 가처분신청을 접수했다""며 쌍용차 인수 의지를 밝히면서 주가가 반등했다. 이날 외국인과 개인은 에디슨EV를 각각 151억원, 119억원 순매수한 것으로 나타났다.에디슨EV는 지난해 상반기만 하더라도 주가가 2000원대를 넘지 못했으나 쌍용차 인수 후보로 거론되기 시작하면서 8천원~1만원대로 뛰어올랐고, 인수 후보로 최종 낙점된 12월에는 장중 8만원대까지 치솟는 등 투기성 자본이 몰렸다. 올 들어서는 2만원대에서 등락을 거듭하는 상황이었는데 쌍용차 인수계약이 해지되면서 급락했다.쌍용차는 전날 ""에디슨모터스 컨소시엄이 지난 25일 예치해야 할 인수대금을 예치하지 않았다""며 ""M&A 투자계약에 의거해 자동해제됐다""고 공시했다.에디슨모터스는 지난 25일까지 인수대금 3049억원 중 계약금 305억원을 뺀 잔금 2743억2000만원을 내야 했지만 그러지 못했다.에디슨모터스는 지난 24일 매각주관사인 EY한영을 통해 법원에 관계인집회 일정을 5월 중순 이후로 미뤄 달라고 요청했지만, 쌍용차와 EY한영은 법원과 논의 끝에 인수 대금을 구하지 못한 것은 집회 연기 사유가 될 수 없다고 통보했다.결국 에디슨모터스는 기간 내 잔금을 납입하지 못했고 '계약 즉시 해제' 사유가 발생했다. 에디슨모터스는 쌍용차 인수 후보 단계부터 적격 여부 등이 지적되며 각종 논란에 휩싸인 바 있다."
20220329,화,쌍용차,"[이데일리 최영지 기자] 다음은 29일 장 마감 후 주요 공시다.△SK바이오팜(326030)은 수면장애 신약인 ‘솔리암페톨’의 상업화 권리가 재즈 파마슈티컬스(Jazz Pharmaceuticals)에서 엑솜 테라퓨틱스(Axsome Therapeutics)사로 이전됐다고 설명.△SK(034730)는 올해부터 2025년까지 매년 경상 배당수입의 30% 이상을 기본배당하고, 시가총액의 1% 이상 규모의 자사주를 매입한다고 공시.△카카오(035720)는 여민수·조수용 대표체제에서 남궁훈 단독 대표 체제로 변경. 우수 인재 리텐션 강화 및 기업가치 향상을 위한 성과 달성을 위해 100억원 규모 자기주식을 처분하기로 결정.△쌍용자동차(003620)는 서울회생법원이 다음달 1일 개최될 예정이었던 회생계획안 심리 및 결의를 위한 관계인집회를 취소. 이와 관련 “M&A 투자계약이 해제돼 관리인이 제출한 회생계획안을 관계인집회의 심리 및 결의에 부치지 않기로 결정했다”고 설명.△에디슨EV(136510)는 서울중앙지방법원에 쌍용차(003620) 인수합병(M&A) 투자계약 해제에 따른 계약 해제 효력정지 등 가처분신청을 청구.△삼성바이오로직스(207940)는 인천경제자유구역청(IFEZ)으로부터 4260억원 규모 ‘송도국제도시 첨단산업클러스터(C) Ki19’ 부지를 매입을 이사회에서 의결.△두산(000150)은 박정원·김민철·곽상철 대표이사 체제에서 박정원·김민철·문홍성 각자 대표이사 체제로 변경.△피에이치씨(057880)의 관계사 필로시스가 가톨릭대학교 은평성모병원으로부터 타액방식의 코로나19 항체 신속진단키트(Gmate COVID-19 Ag Saliva)제품의 임상연구심사위원회(IRB)승인을 획득했다고 공시.△CJ씨푸드(011150)는 이인덕·오재석 각자 대표체제에서 이인덕·김정웅 대표 체제로 변경.△하림(136480)은 김홍국, 박길연 각자대표이사 체제에서 김홍국, 정호석 각자 대표이사 체제로 변경.△SNK(950180)는 공개매수를 통한 자진 상장폐지를 위해 다음달 14일 오후 부산 힐튼호텔에서 임시 주주총회를 개최.△큐브엔터테인먼트(182360)는 블록체인기술 전문기업 주식회사 네스트리미디어그룹이 진행하는 유상증자에 참여.△스튜디오드래곤(253450)은 대표이사가 강철구, 김영규씨에서 김제현, 김영규씨로 변경.△오스템(031510)은 경영효율화를 위해 김정우 단독 대표이사 체제에서 김정우, 김동효 각자대표이사 체제로 변경."
20220329,화,쌍용차,"[서울경제]<유가증권>▲카카오(035720)=남궁훈 대표이사 신규 선임, 자사주 103억 원 처분 결정 ▲SK바이오팜(326030)=솔리암페톨의 상업화 권리 ‘Axsome Therapeutics’사로 이전 ▲SK(034730)=주주 환원 정책으로 2025년까지 매년 경상 배당 수입의 30% 이상 기본 배당, 시총 1% 이상 자사주 매입 결정 ▲계룡건설(013580)산업=계룡산업과 2109억 원 규모 공동주택 신축공사 계약 체결 ▲신성이엔지(011930)=천장형 공기 청정 특허 취득 ▲미원상사(002840)=자사주 43억 원 규모 취득 결정 ▲에스디바이오센서(137310)=생산 시설 확충 위해 1880억 원 규모 신규 투자 결정 ▲CJ씨푸드(011150)=이인덕·김정웅 각자 대표로 변경 ▲한국내화(010040)=변성희 대표이사로 변경 ▲현대비앤지스틸(004560)=정일선·이선우 각자 대표로 변경 ▲코오롱글로벌(003070)=김정일 대표이사 신규 선임 ▲모나리자(012690)=주광옥 대표이사 신규 선임 ▲LX홀딩스(383800)=구본준·노진서 대표이사로 변경 ▲화승알앤에이(378850)=김형진 대표이사 신규 선임 ▲HMM(011200)=김경배 대표이사 신규 선임 <29일><코스닥>▲에스엠(041510)=검사인 선임(원고 얼라인파트너스자산운용) 소송 제기 ▲에디슨EV(136510)=쌍용차 인수합병(M&A) 투자 계약 해제에 따른 계약 해제 효력 정지 등 가처분 신청 ▲GRT(900290)=자진 상폐를 위해 최대주주 주영남이 상장주식 1855만 2201주 공개 매수 ▲수성이노베이션(084180)=이브이수성으로 상호 변경 ▲에이비엘바이오(298380)=이중 항체 항암제 ABL001 제1b상 임상 시험 결과 공시 ▲DMS(068790)=중국 광저우 반도체 디스플레이 업체와 502억 원 규모 공정 장비 계약 체결 ▲피에이치에이(043370)=허승현 대표이사 신규 선임 ▲에프에스티(036810)=장경빈 대표이사로 변경 ▲원익QnC(074600)=백홍주 대표이사 신규 선임 ▲이니텍(053350)=김준근 대표이사 신규 선임 ▲수산아이앤티(050960)=이홍구 단독 대표이사로 변경 ▲한국알콜(017890)=지용석·김정수·유정림 대표이사로 변경 ▲에이디엠코리아(187660)=임종언 대표이사로 변경 ▲오공(045060)=김윤정 단독 대표이사로 변경 <29일>"
20220329,화,쌍용차,"2022년 3월 29일 마감시황 다시보기정부와 한국전력이 올해 2분기 연료비 조정단가를 동결한 29일 서울의 한 주택가에 전기계량기가 설치돼 있다. 연합뉴스국내 증권시장이 기관 매수세 유입에 힘입어 상승 마감했다.코스피지수는 28일 11.51포인트(0.42%) 오른 2741.07에 거래를 마쳤다. 장 초반 2750선을 탈환했으나 외국인의 매물이 쏟아지며 상승 폭을 일부 반납했다. 투자자별 동향을 살펴보면 기관이 나홀로 3270억원을 순매수하며 지수 상승을 견인했다. 외국인은 2834억원, 개인은 87억원 순매도했다. 코스닥지수는 전날보다 10.72포인트(1.16%) 상승한 937.83에 장을 닫았다.미래에셋증권은 “미국 증시가 실적 개선 기대가 유입된 기술주 중심의 강세를 보인점이 국내 증시에 긍정적인 영향을 줬다”며 “코스닥은 나스닥 기술주 강세와 외국인 매수 유입 확대에 힘입어 상승했다”고 분석했다.1. 한국전력 [015760]올해 2분기 연료비 조정단가가 동결되며 한국전력이 2.80% 하락한 2만2550원에 거래를 종료했다. 한국전력은 이날 연료비 조정단가를 킬로와트시(㎾h)당 0원으로 확정했다고 밝혔다.한전은 “국제 연료가격 상승 영향으로 2분기 연료비 조정단가 조정 요인이 발생했으나 코로나19 장기화와 높은 물가상승률 등으로 어려움을 겪는 국민 생활 안정을 도모할 필요성이 있다”며 “지난해 12월 확정돼 오는 4월부터 적용되는 2022년 기준연료비 및 기후환경요금 인상분(㎾h당 6.9원)을 고려했다”고 설명했다.한전은 2016년만 해도 현대차, 삼성물산과 시가총액 2위 자리를 두고 경쟁했다. 고점이던 2016년 5월 6만3700원과 비교하면 3분의 1토막이 났다. 전기료 인하와 동결이 반복되며 영업적자 규모가 커진 여파다. 한전은 지난해 5조8601억원에 달하는 영업적자를 냈다. 최근 연료비 급등으로 올해 적자 규모가 20조원을 넘어설 수 있다는 전망까지 나온다.정부는 지난해 전기요금이 유가 등 에너지 가격에 따라 움직이도록 연료비 연동제를 도입했지만, 코로나19 확산세를 이유로 전기요금을 동결해왔다. 신영증권은 “연료비 조정단가가 동결된다면 한국전력 적자 폭이 확대되는 것은 시간문제”라며 “에너지 가격 상승세가 한국전력의 비용 증가로 전가되며 적자 폭이 커졌다”라고 분석했다.2. 에디슨EV [136510]에디슨모터스의 쌍용자동차 인수가 무산되면서 자회사인 에디슨EV 주가가 큰 폭의 널뛰기를 이어갔다. 에디슨EV는 코스닥시장에서 전날보다 5.31% 내린 1만1600원에 거래를 끝냈다. 장 초반 20%대 급락세를 이어가며 하한가에 가까운 8720원까지 떨어졌으나, 오후 2시30분을 기점으로 21.63% 치솟으며 1만4900원까지 오르기도 했다.에디슨EV가 이 시각 인수 계약 해제 효력정지 가처분 신청 사실을 공시하면서다. 에디슨EV는 쌍용차를 상대로 인수합병(M&A) 투자계약 해제에 따른 계약해제 효력정지 등 가처분을 서울중앙지법에 신청했다고 밝혔다. 이후 빠른 속도로 상승 폭을 반납하고 등락을 거듭하다 하락 마감했다. 에디슨EV는 전날에도 가격제한폭(29.80%)까지 내려 하한가인 1만2250원을 기록했다.에디슨모터스는 인수대금 잔금 2743억여원을 기한까지 납입하지 않아 계약 즉시 해지 사유가 발생했다. 여기에 에디슨EV는 4년 연속 영업손실을 냈고 에디슨모터스가 최근 인수한 유앤아이도 경영 여건 악화로 적자를 내고 있다.3. 시멘트주시멘트 업체들이 일제히 급등세를 보였다. 러시아와 우크라이나 간 전쟁이 장기화 국면에 접어들며 시멘트 원재료인 유연탄 품귀현상 우려가 커지면서다.성신양회는 유가증권시장에서 성신양회는 전날보다 7.91% 오른 1만5000원에 마감했다. 성신양회 우선주도 가격제한폭(29.81%)까지 오른 2만900원을 기록했다. 이밖에 시멘트주로 분류되는 아세아시멘트(9.21%), 한일시멘트(3.69%), 쌍용C&E(2.08%) 등도 상승 마감했다.지난해 하반기부터 수급 불균형 이슈로 꾸준히 우상향 곡선을 그려왔던 유연탄 가격은 우크라이나 전쟁으로 빠르게 치솟고 있다. 유연탄은 러시아 수입 의존도가 75%에 달한다. 유연탄 가격이 급등해 시멘트 역시 가격 인상이 불가피할 것으로 관측된다. 현재 시멘트 고시 가격은 t당 7만8800원이다.실제로 건설업체와 시멘트 가격 협상을 진행 중인 시멘트 업계는 최근 유연탄 가격 급등을 반영해 t당 11만원까지 인상안을 제시한 것으로 알려졌다. 시멘트업계는 선두권 회사가 고객사인 레미콘사들에 가격 인상을 통지하면, 다른 시멘트사들이 개별 상황을 판단하는 구조로 가격을 결정해 왔다신영증권은 “11만원 추가 인상을 제시한 상황에서 시멘트 가격은 t당 9만원 이상으로 결정될 가능성이 크다”며 “t당 1만원 인상의 보수적 가정을 적용해도 매출은 평균 15.0% 증가할 것”이라고 전망했다.하루 3분이면 충분한 여의도 산책. [3분 국내주식]은 동학 개미의 시선으로 국내 증권시장을 관찰합니다. 차트와 캔들이 알려주지 않는 상승과 하락의 원인을 추적하고, 하루 사이에 주목을 받은 종목들을 소개합니다."
20220329,화,쌍용차,에디슨모터스의 쌍용차 인수가 무산되며 에디슨EV가 널뛰기 장세를 보였다.29일 코스닥시장에서 에디슨EV는 전 거래일보다 5.31% 내린 1만1천600원에 거래를 마쳤다.주가는 오전부터 장중 20% 이상 급락세를 이어가며 한때 하한가에 가까운 8천720원까지 떨어졌다. 그러나 에디슨EV가 오후 2시 30분께 인수 계약 해제 효력정지 가처분 신청 사실을 공시한 직후 주가는 전날보다 21.63% 오른 1만4천900원까지 치솟았다.이후 다시 상승 폭을 빠르게 반납하고 등락을 거듭하다가 하락 마감했다.에디슨EV는 인수 무산 사실이 알려진 전날 가격제한폭(29.80%)까지 내려 하한가인 1만2천250원에 마감했다.에디슨모터스는 쌍용차 인수를 위해 계약금으로 지급한 305억원을 제외한 잔금 2천743억원을 지난 25일까지 인수대금으로 내야 했으나 납입에 실패했다. 이에 투자 계약은 자동 해제됐다.회사 측은 쌍용차 인수자금 마련을 위해 인수한 관계사 에디슨EV를 통해 투자를 유치하려 했으나 뜻대로 되지 않은 것으로 전해졌다.이날 에디슨EV는 쌍용차를 상대로 인수합병(M&A) 투자계약 해제에 따른 계약해제 효력정지 등 가처분을 서울중앙지법에 신청했다고 공시했다.(사진=연합뉴스)
20220329,화,쌍용차,"코스피가 29일 상승 마감해 2,740선을 회복했다. 사진은 이날 장을 마감한 서울 명동 하나은행 본점 딜링룸 모습. [사진 제공 = 연합뉴스]코스피가 기관의 매수세에 힘입어 강세 마감했다.29일 코스피는 전일 대비 11.51포인트(0.42%) 오른 2741.07에 장을 마쳤다.이날 지수는 16.06포인트 오른 2745.62에 개장해 상승세를 이어갔다. 외국인의 매도 공세에 2730선으로 밀리기도 했으나 개인과 기관이 매수 우위를 보이며 지수를 방어했다. 2730선에서 제한적인 등락을 이어가던 중 장 마감 직전 개인이 순매도로 전환했다. 하지만 기관의 매수세에 힘입어 하루 만에 반등에 성공했다.지난 밤 뉴욕증시는 러시아와 우크라이나 간의 지정학적 긴장이 완화될 것이라는 기대감과 유가 하락으로 상승 마감했다. 다우지수는 0.27%, S&P500지수는 0.71% 올랐다. 기술주 중심의 나스닥 지수는 1.31% 상승했다.이경민 대신증권 연구원은 ""지난 밤 러시아와 우크라이나의 평화 협상 기대감 유입으로 미국 증시가 상승전환한 점과 유가 급락에 따른 인플레이션 우려 완화, 위험선호 심리 개선으로 코스피 지수가 상승했다""면서도 ""외국인이 3거래일 연속 현물 순매도하고 펀더멘털(기초체력) 개선을 기반으로 한 뚜렷한 상승모멘텀이 부재한 가운데 오후 들어 상승폭이 축소됐다""고 설명했다.아시아 증시는 혼조세를 보이고 있다. 오후 4시 2분 현재 일본 닛케이지수, 홍콩 항셍지수는 각각 1.10%, 0.80% 상승하는 반면 중국 상하이종합지수, 심천종합지수는 각각 0.32%, 0.66% 하락세를 보였다.이날 유가증권시장에서는 업종별로 전기·전자, 제조업, 화학, 운수창고, 서비스업, 유통업, 의약품이 강세를 보인 반면, 전기가스업, 건설업, 기계, 섬유·의복이 약세를 나타냈다.매매주체별로 개인과 외국인은 82억원, 2832억원 순매도한 반면 기관은 3265억원 순매수했다. 프로그램 매매는 970억원 매도 우위를 나타냈다.시가총액 상위 종목 중에서는 SK하이닉스, 삼성SDI, 셀트리온, 현대차, LG에너지솔루션이 1%대 강세를 기록했다. KB금융, 카카오뱅크, POSCO홀딩스는 약세 마감했다.이날 유가증권시장에서는 477개 종목이 상승했고 386개 종목이 떨어졌다.코스닥은 전일 대비 10.72포인트(1.16%) 오른 937.83에 마감했다.이날 에디슨모터스의 쌍용차 인수가 무산된 가운데 에디슨EV 주가가 큰 폭으로 널뛰기했다. 코스닥시장에서 에디슨EV는 전 거래일 대비 5.31% 내린 1만1600원에 거래를 마쳤다.에디슨EV는 오전부터 장중 20% 이상 급락세를 이어가며 한때 하한가에 근접한 8720원까지 떨어졌지만 오후 2시 30분께 인수 계약 해제 효력정지 가처분 신청 사실을 공시한 직후 주가는 1만4900원까지 치솟았다."
