date,day,word,text
20220329,화,배럴,"매월 하루 43만2000배럴 증산계획 유지""사우디, 러시아와 협력관계 유지 원해""[이데일리 고준혁 기자] 우크라이나 사태로 국제유가가 치솟은 가운데 석유수출국기구(OPEC)와 비(非)OPEC 국가들의 협의체인 OPEC플러스(+)가 원유를 증산하지 않을 전망이다. 미국을 비롯한 서방국들의 요청에도 최대 산유국인 사우디아라비아가 러시아의 심기를 건드리지 않으려 하기 때문이라는 분석이 나온다.모하메드 빈 살만 사우디아라비아 왕세자이자 부총리 겸 국방장관. (사진=AFP)28일(현지시간) 로이터 통신은 7명의 소식통을 인용, OPEC+가 5월 원유 생산량을 기존 계획대로 완만하게 늘릴 것이라고 전했다. OPEC+는 지난해 8월 이후 매월 하루 40만배럴의 원유 생산량을 늘려왔다. 오는 5월부터는 증산폭을 하루 43만2000배럴 늘릴 계획이라고 작년부터 밝혀왔다. 기존에 세웠던 계획을 변경하지 않고 그대로 실행하겠다는 것이다.미국을 포함한 서방국가들이 오는 5월부터 증산폭을 늘려달라 요청했지만 OPEC+가 듣지 않은 것이다. 미국은 40년 만의 최대 물가상승률을 억제하기 위해 폭등하는 에너지 가격을 진정시키려 하고 있다. 서부텍사스산원유(WTI) 선물가격은 연초대비 이날까지 약 36% 상승했다.OPEC+에 러시아가 포함돼 있는 상황에서 중동 회원국들이 러시아의 눈치를 보기 때문이란 해석이 나온다. 소식통은 “사우디아라비아가 5월 원유 생산량을 당초 계획보다 더 늘리는 것을 꺼리고 있다”며 “사우디가 러시아와의 석유 정책에 대한 협력 관계를 깨고 싶지 않아한다”라고 설명했다. 서방국들의 제재로 대부분의 원유 수출이 막힌 러시아는 그나마 유가가 높은 수준을 유지해야 경제 충격을 줄일 수 있다.사우디가 예멘과의 전쟁에서 미국의 지원을 더 이끌어내기 위한 협상 카드로 원유를 사용하고 있다는 해석도 있다. 미국이 원하는 대로 원유를 증산하려면 이에 상응하는 대가가 있어야 한다는 것이다. 앞서 월스트리트저널(WSJ) 등은 사우디가 예멘 내전에 개입하고 있는데 충분한 미국의 지원이 없다며 불만을 품고 있다고 전했다."
20220329,화,배럴,"간밤 국제유가가 중국 상하이가 코로나19를 억제하기 위해 순환 봉쇄에 들어갔다는 소식에 급락하자 원유관련주가 일제히 하락하고 있다.29일 오전 9시 10분 흥구석유는 전 거래일 대비 180원(2.14%) 내린 8,240원에 거래되고 있다.같은 시간 흥구석유는 250원(1.40%) 내린 1만 7,650원에 거래되고 있고, S-Oil은 1,700원(1.74%) 내린 9만 6,200원에 거래 중이다.현지시간 28일 뉴욕상업거래소에서 5월물 서부텍사스산원유(WTI) 가격은 전장보다 7.94달러(7%) 하락한 배럴당 105.96달러에 거래를 마쳤다.이는 종가 기준 3월 18일 이후 가장 낮은 수준이다."
20220329,화,배럴,"다우 0.27%, S&P500 0.71%, 나스닥 1.31% 상승5차 회담 29일 개최…국제유가 7% 급락바이든 7100조원 예산안…국방비 증액·재정적자 축소3월 국내 소비심리 소폭 개선…기대인플레 2.9%[이데일리 이은정 기자] 뉴욕증시가 러시아와 우크라이나의 지정학적 위험 완화 기대감과 국제유가 급락에 일제히 상승했다. 양측은 29일(현지시간) 터키에서 5차 평화 회담을 열 예정이다. 협상을 앞두고 러시아 대변인은 지금까지 협상에 큰 진전은 없었고, 현재로선 양 정상간 회담은 없을 것이라고 밝혔다.조 바이든 미국 대통령은 7100조원 규모의 예산안을 발표했다. 국방비 증액, 재정적자 축소 내용 등이 포함됐다. 국제유가는 중국 상하이 봉쇄 영향에 7% 하락했다. 다음은 개장 전 주목할 만한 뉴스다.(사진=AFP 제공)뉴욕증시, 지정학 위험 완화 기대감에 일제히 상승-28일(현지시간) 뉴욕증권거래소(NYSE)에서 다우존스30산업평균지수는 전장보다 0.27% 오른 3만4955.89로 마감.-스탠더드앤드푸어스(S&P)500지수는 0.71% 상승한 4575.52, 기술주 중심의 나스닥 지수는 1.31% 오른 1만4354.90으로 마쳐.-투자자들은 러시아와 우크라이나 간의 지정학적 긴장, 유가 하락세, 국채금리 움직임 등을 주목. 3월 국내 소비심리는 소폭 개선.러 “협상 진전 없어…지금은 푸틴-젤렌스키 회담 안 돼”- 러시아가 우크라이나와 5차 평화협상을 앞두고 “지금까지 협상에서 큰 진전 사항은 없으며, 현재로선 블라디미르 푸틴 대통령과 볼로디미르 젤렌스키 우크라이나 대통령의 회담도 없을 것”이라고 밝혀.-드미트리 페스코프 러시아 크렘린궁 대변인은 28일 러시아와 우크라이나 간 평화 회담 진전 사항에 대해 이같이 밝혔다고 스푸트니크 통신 등이 보도.-페스코프 대변인은 터키에서 양국의 5차 평화 회담이 열리는 데 대해 “지금까지 중요 사안에서 성과를 내거나 돌파구를 마련하지 못했다”며 “중요 내용에 대한 합의가 있으면 푸틴 대통령과 젤렌스키 대통령의 회담이 가능할 것”이라고 말해.-양측은 29일(현지시간) 터키에서 5차 평화 회담을 열 예정이다.러 “국가 존립 위협 있을 때만 핵무기 사용”-러시아 당국은 29일(현지시간) “국가 존립에 위협이 있을 때에만 핵무기를 사용할 것”이라고 언급.바이든 7100조원 예산안…국방비 증액·재정적자 축소-조 바이든 미국 행정부는 28일(현지시간) 5조8000억달러(약 7100조원) 규모의 2023 회계연도 예산안을 발표.-우크라이나 사태 등 급변하는 안보 환경에 따른 국방 예산 증액과 청정에너지 등 기후변화, 전염병 관련 예산 지출을 늘리는 데 초점.-이를 위해 초부유층에 대한 세금을 신설하는 등 세수를 확보한다는 구상도 .-아울러 국가 재정 건전성을 제고하기 위해 향후 10년간 약 1조달러(약 1200조원)의 재정 적자를 줄이겠다는 내용 포함.문-윤, 첫 만찬회동 마쳐-문재인 대통령과 윤석열 당선인은 28일 밤 청와대서 대선이후 첫 회동 마쳐. 장제원 당선인 비서실장은 이날 서울 통의동 기자회견장에서 “화기애애한 분위기 속에 흉금을 털어놓고 이야기를 했다”고 전해.-문 대통령과 윤 당선인은 청와대 이전, 추가경정예산(추경), 안보, 코로나19 대응 등 다양한 주제를 놓고 대화를 이어. 양측은 추경 필요성, 빈틈없는 안보, 코로나19 대응 중요성에 대해 공감. 나머지 쟁점 현안에 대해서는 구체적인 합의는 없어.소비심리 소폭↑…기대인플레 2.9%-한국은행이 23일 발표한 ‘소비자동향조사’ 결과에 따르면 3월 소비자심리지수(CCSI)는 103.2로 2월보다 0.1포인트(p) 높아져. 지난달 1.3포인트 떨어진 뒤 한 달 만에 반등.-코로나19에 대한 일부 방역 조치 완화 등의 영향으로 소비자들의 체감 경기가 지난달보다 다소 좋아져.-다만 향후 1년의 소비자물가 상승률에 대한 전망치는 2.9%에 이르렀고, 주택가격의 추가 상승에 무게를 두는 견해가 눈에 띄게 늘어.국제유가 급락…상하이 코로나19 봉쇄-뉴욕상업거래소에서 5월 인도분 서부텍사스산원유(WTI) 가격은 7% 떨어진 배럴당 105.96달러에 거래를 마쳐.-중국의 경제 수도인 상하이시마저 오미크론 변이의 확산 앞에 결국 봉쇄를 택한 여파.김정은, 선전간부들에 철저한 사상제일주의 강조-조선중앙통신은 29일 김정은 북한 국무위원장이 전날 개최된 당 제1차 선전부문일군(간부)강습회 참가자들에게 “반사회주의, 비사회주의와의 투쟁에서 사상전의 포격을 집중화·정밀화할 데 대해 강조했다”고 보도. 김 위원장은 사상제일주의 중요성 부각, 형식주의 타파도 촉구.-북한은 내부적으로는 대북제재와 신종 코로나바이러스 감염증(코로나19)에 따른 국경봉쇄로 경제난이 악화한 가운데 최근 대륙간탄도미사일(ICBM) 발사 등으로 미국 등 국제사회와 대립각을 세우고 있어.인수위, 총리실·법무부 끝으로 업무보고 일정 마무리-윤석열 대통령 당선인의 대통령직인수위원회는 29일 국무총리실과 법무부 등 11개 정부 부처·기관의 업무보고를 끝으로 지난 22일부터 시작된 업무보고 일정을 마무리.-정부부처 업무보고는 이날로 끝나지만, 독립기관인 고위공직자수사처(공수처)와는 오는 30일 별도의 간담회를 하기로. 이날 정무사법행정분과는 국무총리실과 법무부, 인권위의 업무보고를 받아."
20220329,화,배럴,"미국 원유시추설비 © AFP=뉴스1(서울=뉴스1) 신기림 기자 = 국제유가가 7% 급락했다.28일(현지시간) 미국 서부텍사스원유(WTI) 선물은 7% 밀려 배럴당 105.96달러를 기록했다. 북해 브렌트유 선물도 6.8% 하락해 배럴당 112.48달러에 체결됐다.중국의 금융허브 상하이가 신종 코로나바이러스 감염증(코로나19)로 단계적 봉쇄에 들어가면서 유가가 급락했다.상하이 봉쇄로 테슬라 공장도 31일까지 나흘 동안 가동이 중단된다.원자재가 너무 뜨겁게 올랐다는 점에서 하락해도 놀랍지 않다고 샌프란시스코 소재 웨드부시증권의 스티븐 마소카 수석부사장은 로이터에 말했다. 그는 ""대부분 원자재 관련주는 아직 매우 매우 좋다""고 덧붙였다."
20220329,화,배럴,"러-우크라 5차 평화협상 성공 가능성에 기대감국제유가 7%대 급락유럽·중국 혼조·베트남 하락[글로벌시장 지표 / 3월 29일 오전 6시 현재][미국증시 마감시황]뉴욕증시는 28일(미 동부시간) 상승마감했다.이날 뉴욕증권거래소(NYSE)에서 다우존스30산업평균지수는 전장보다 94.65포인트(0.27%) 오른 34,955.89로 거래를 마쳤다. 스탠더드앤드푸어스(S&P)500지수는 전장보다 32.46포인트(0.71%) 상승한 4,575.52로, 기술주 중심의 나스닥 지수는 전장보다 185.60포인트(1.31%) 오른 14,354.90으로 거래를 마감했다.시장은 오는 29일 터키 이스탄불에서 열릴 러시아-우크라이나 간 5차 평화협상에 기대감을 걸며 상승했다. 회담을 앞두고 젤렌스키 대통령이 돈바스 지역의 영토 문제를 논할 수 있다는 유연한 입장을 밝혀 회담 성공 가능성에 대한 기대가 높아진 것이다.여기에 국제유가는 급락하면서 투심을 떠받쳤다. 뉴욕상업거래소에서 5월 인도분 서부텍사스산원유(WTI) 가격은 7% 떨어진 배럴당 105.96달러에 거래를 마쳤다.중국 상하이시가 코로나19 확산세를 막기 위해 28일부터 전체 도시를 절반씩 나눠 순환식 봉쇄에 들어가는 가운데, 원유 수요가 줄어들 수 있다는 우려가 나온다.이날 5년물 국채 금리가 30년물 국채 금리를 웃돌면서 2006년 이후 처음으로 해당 금리의 금리 역전이 발생했으나 주식 시장에 미치는 영향은 제한됐다.이와 관련해 JP모건의 마르코 콜라노비치 수석 글로벌 시장 전략가는 “수익률 곡선 역전에도 단기적으로 미국 경제가 침체에 빠질 가능성은 작다”고 분석했다.[특징주]■ 기술주이날 기술주는 대부분 강세를 보였다.마이크로소프트(2.31%)와 아마존(2.56%) 주가가 오름세를 보였다. 애플 주가는 애플이 다음 분기에 아이폰 SE 생산 규모를 기존 계획보다 20%가량 축소할 것으로 공급업체들에 통보했다는 소식에도 0.5% 올랐다.■ 테슬라테슬라(TSLA)는 2년 만에 주식 분할을 결정하면서 8.03% 상승했다.■ 에너지주유가 하락의 영향으로 셰브론(-1.75%)과 엑손모빌(-2.81%)의 주가는 떨어졌다.■ 은행주국채 수익률 하락의 영향으로 골드만삭스, JP모건의 주가는 약보합권에서 거래를 마쳤고 씨티그룹과 웰스파고는 각각 1.45%, 1.5% 떨어졌다.■ 코인베이스코인베이스가 브라질 암호화폐 중개 업체 인수에 나섰다는 소식에 이날 7.87% 뛰었다.■ AMC밈주 중 하나로 꼽히는 영화체인 AMC의 주가는 기업 구조를 바꾸는 인수합병(M&A)이 기다리고 있다는 애덤 애런 최고경영자(CEO)의 발언으로 이날 44.91% 폭등했다.[유럽증시 마감시황]유럽 주요국 증시는 28일(현지시간) 혼조 마감했다.독일 프랑크푸르트 증시의 DAX30 지수는 전 거래일 종가 대비 0.78% 오른 14,417.37로 장을 마쳤고, 프랑스 파리 증시의 CAC40 지수는 0.54% 뛴 6,589.11로 마감했다. 범유럽 지수인 유로 Stoxx50은 0.5% 상승한 3,887.10을 기록했다.[중국증시 마감시황]중국증시는 28일 혼조 마감했다.장 마감 기준 상하이종합지수는 0.07% 상승한 3214.50P, 선전성분지수는 1.02% 떨어진 11949.94P, 창업판지수는 1.66% 내린 2594.13P로 장을 마쳤다.선전성분지수는 장중 한때 2% 가까이 하락했고 상하이종합지수와 창업판지수는 장중 1.6% 가까이 떨어졌다. 이후 상하이종합지수는 혼조 속 소폭 상승했고 선전성분지수와 창업판지수도 낙폭을 좁혔다.오후장에서 주가지수는 양분화 현상이 두드러졌는데 상하이종합지수는 횡보합 혼조세를 이어간 반면 창업판지수의 낙폭은 2% 가까이 떨어지기도 했다.이날 종목별 거래 상황을 보면 부동산주의 상한가 흐름이 두드러졌고 염호리튬, 백주 등 섹터의 하락세가 두드러졌다.[베트남증시 마감시황]베트남 증시는 28일(현지시간) 하락 마감했다.VN지수는 전 거래일에 비해 15.32p, 1.02% 하락한 1,483.18p을 기록하며 하루만에 1500선을 내줬고 지난 14일 이후 가장 큰 하락폭을 그렸다.베트남증시 시가총액 상위30대 종목 바스켓 VN30지수도 14.20p(0.95%) 내린 1,484.16p로 마감했고 3개 종목 상승, 24개 종목이 하락했다.중소형주 위주의 하노이증권거래소(HNX)는 6.86p 하락한 454.89p를, 비상장기업 시장의 UPCoM지수도 1.00p 내린 116.01p를 기록했다.총 거래대금은 32조8,800억동(미화 14억4,000만달러)으로 전 거래일에 비해 34% 증가했고, 지난 3주만에 최고치를 기록했다.산업별 증시 현황에서는 25개 섹터 중 8개 업종이 상승을, 17개 업종이 하락했다.은행업 -1.49%, 증권업 -2.53%, 보험업 -0.53%, 건설·부동산업 -1.90%, 정보통신(ICT)업 1.86%, 도매업 0.28%, 소매업 2.88%, 기계류 -0.10%, 물류업 -0.59%, 보건·의료업 -0.20%, F&B업 -0.59%, 채굴·석유업 1.84%를 각각 기록했다.외국인 투자자들은 890억동 순매도하며 3거래일 연속 순매도를 이어갔다.[국제유가]국제유가는 28일(현지시간) 하락했다.이날 뉴욕상업거래소에서 5월물 서부텍사스산원유(WTI) 가격은 전일대비 7.94달러(7%) 내린 배럴당 105.96달러에 거래를 마감했다.[금]금값은 28일(현지시간) 하락했다. 이날 뉴욕상품거래소에서 4월 인도분 금은 온스당 0.7% 하락한 1939.80달러에 장을 마감했다.* 더 많은 글로벌투자 뉴스는 [한경 KVINA] 홈페이지에서 볼 수 있습니다."
20220329,화,배럴,"기사내용 요약5년물·30년물 국채금리 한 때 역전테슬라, 주식 분할 추진에 7.8%↑국제유가, 中상하이 봉쇄령에 7% 하락[뉴욕=AP/뉴시스]미 뉴욕증권거래소 모습.[서울=뉴시스] 신정원 기자 = 28일(현지시간) 러시아와 우크라이나 평화 협상 재개를 앞두고 지정학적 리스크 완화 기대와 유가 하락 속에 뉴욕증시 주요 지수가 일제히 상승 마감했다. 테슬라의 연내 주식 분할 기대감 등 기술주가 상승을 견인했다.이날 뉴욕증권거래소(NYSE)에서 다우존스 30 산업평균 지수는 전장 대비 94.65포인트(0.27%) 상승한 3만4955.89에 거래를 마쳤다.스탠더드앤드푸어스(S&P) 500 지수는 32.46포인트(0.71%) 오른 4575.52, 기술주 중심의 나스닥 지수는 185.60포인트(1.31%) 뛴 1만4354.90에 폐장했다.CNBC, 마켓워치 등에 따르면 다우 지수와 S&P 500 지수는 3거래일 연속 상승했다.나스닥 지수는 기술주 상승에 힘입어 1.3% 상승했다. 특히 테슬라는 주식 분할 추진 소식에 7.8% 큰 폭으로 뛰었다. 마이크로소프트와 아마존도 각 1.9%와 2.3% 올랐다.30년물과 5년물 국채금리는 2006년 처음으로 한 때 역전되면서 경기 침체 우려를 낳았다. 통상 금리역전은 경기 침체 전조로 여겨진다. 5년물 국채금리는 2.63%로 상승한 반면 30년물 국채금리는 2.60%로 보이다 다시 정상화했다.국제유가는 중국 상하이의 코로나19 순환 봉쇄령으로 인한 수요 둔화 전망에 7% 가까이 크게 하락했다.뉴욕상업거래소(NYMEX)에서 5월물 미 서부 텍사스산 원유(WTI)는 전 거래일 대비 7.94달러(7%) 하락한 배럴당 105.96달러에 거래를 마쳤다. 북해산 브렌트유 선물 가격은 배럴당 7% 가까이 빠진 112.48달러에 거래됐다.에너지주는 유가와 함께 빠졌다. 쉐브론과 엑손모빌이 각 1.8%와 2.8% 내려갔다.은행주들은 하향 조정됐다. JP모건은 0.7%, 웰스파고는 1.4% 하락했다.투자자들은 우크라이나 전쟁 상황도 계속 보고 있다.러시아와 우크라이나가 오는 29일 평화 협상을 재개하는 가운데 월가의 공포지수로 불리는 시카고옵션거래소(Cboe) 변동성지수(VIX)는 5.6% 하락하며 지난 1월14일 이후 처음으로 20 아래(19.63)로 마감했다.연방준비제도(Fed·연준)의 움직임도 예의주시하고 있다. 제롬 파월 연준 의장이 매파적 발언을 하면서 오는 5월 한 번에 기준금리를 0.5% 올리는 '빅 스텝' 가능성에 무게가 실리고 있다.한편 대표적인 암호화폐 비트코인은 이날 오후 5시7분 현재 24시간 전 대비 3221.18달러(7.18%) 오른 4만8089.50달러, 이더리움은 244.09달러(7.68%) 상승한 3420.97달러에 거래되고 있다．"
20220329,화,배럴,"유가 7% 급락 마감…中 금융허브 상하이 봉쇄뉴욕증권거래소 로고 © 로이터=뉴스1(서울=뉴스1) 신기림 기자 = 미국 뉴욕 증시의 간판 지수 스탠다드앤푸어스(S&P)500이 3거래일 연속 상승했다.테슬라가 주식분할 소식에 폭등하면서 에너지주와 금융주의 약세를 만회하며 증시 전반을 끌어 올렸다.러시아와 우크라이나 사이 대면 평화협상이 2주 넘게 만에 재개될 조짐도 증시 상승에 보탬이 됐다.유가가 중국 상하이 봉쇄에 7% 급락한 점도 증시를 지지해줬다.◇S&P500 사흘째 랠리…공포지수 20 밑으로28일(현지시간) S&P500은 전장 대비 32.46포인트(0.71%) 올라 4575.52를 기록했다.다우 지수는 94.65포인트(0.27%) 상승해 3만4955.89로 체결됐다.나스닥 지수도 185.60포인트(1.31%) 뛴 1만4354.90으로 거래를 마쳤다.이날 증시는 테슬라의 활약이 컸다. 테슬라가 2년 만에 다시 주식분할 계획을 공개하면서 주가는 8% 뛰었다. 마이크로소프트(MS)와 아마존도 올랐다.투자 심리가 되살아나면서 월가 공포를 보여주는 CBOE 변동성지수는 올 1월 14일 이후 처음으로 20 밑으로 내려왔다.러시아와 우크라이나가 2주 만에 처음으로 평화협상 재개 소식도 증시를 지지했다. 양국 대표단은 이날 터키에서 협상을 진행했고 다음날인 29일에도 지속될 것이라고 러시아 크렘린궁 대변인이 확인했다.장단기 금리가 순간 역전하며 미 경기침체 우려에 장초반 증시가 불안하기도 했다. 미 국채시장에서 장중 5년 만기와 30년 만기의 수익률(금리)이 2006년 초 이후 처음으로 역전됐다. 미 중앙은행 연방준비제도(연준)가 공격적 금리인상으로 성장이 꺾이며 잠재적으로 침체를 유발할 수 있다는 우려가 커졌다.◇유가 7% 급락…중국 상하이 봉쇄 여파S&P500의 11개 업종 가운데 에너지(-2.56%) 소재 (-0.46%) 금융(-0.3%)을 제외하고 8개가 올랐다. 상승폭은 재량소비재(+2.67%) 부동산(+1.28%) 기술(+1.23%)순으로 컸다.중국의 금융허브 상하이가 신종 코로나바이러스 감염증(코로나19)로 단계적 봉쇄에 들어가면서 유가는 7% 급락했다.미 서부텍사스원유(WTI) 선물은 7% 밀려 배럴당 105.96달러를 기록했다. 북해 브렌트유 선물도 6.8% 하락해 배럴당 112.48달러에 체결됐다.상하이 봉쇄로 테슬라 공장도 31일까지 나흘 동안 가동이 중단된다.유가 하락에 셰브런과 엑손모빌은 1.8%, 2.8%씩 내렸다.원자재가 너무 뜨겁게 올랐다는 점에서 하락해도 놀랍지 않다고 샌프란시스코 소재 웨드부시증권의 스티븐 마소카 수석부사장은 로이터에 말했다. 그는 ""대부분 원자재 관련주는 아직 매우 매우 좋다""고 덧붙였다."
