제목,시간,언론사,본문
"""보너스가 이윤 갉아먹을 것""…아마존, 2020년 이후 첫 '매도' 투자의견",2022-03-31 11:25,한국경제,"(사진=한경DB)세계 최대 전자상거래 업체 아마존이 2020년 이후 처음으로 '매도'(Sell)에 해당하는 증권사 투자의견을 받았다.30일(현지시간) 로이터·블룸버그통신 등에 따르면 프랑스 증권사인 BNP파리바 엑산은 아마존에 대해 인플레이션과 고비용으로 인한 어려움이 예상된다며 투자의견을 '시장수익률 하회'(Underperform), 목표주가를 2800달러로 각각 제시했다.아마존에 대해 매도 의견이 나온 것은 2020년 이후 처음이며 목표가 2800달러는 현 주가보다 약 15.8% 낮은 수준이다. 아마존은 애플, 마이크로소프트(MS), 구글 모기업 알파벳에 이은 미국 증시 시가총액 4위 기업이다.이 증권사 애널리스트인 스테판 슬로윈스키는 ""아마존의 자본지출 증가 폭이 10% 중반에 이를 수 있다""며 ""신종 코로나바이러스 감염증(코로나19) 기간에 신속 배송을 위해 이뤄진 투자와 직원 유지를 위해 지급한 보너스가 회사의 이윤을 갉아 먹을 것""이라고 예상했다.한편 아마존의 주가는 이날 1.78% 하락해 3326달러를 기록했다."
"EDGC, 시그마체인·마이지놈박스와 분산형 디지털신분증 개발",2022-03-31 11:24,한국경제,"유전체 기반 DID 추진왼쪽부터 신상철 EDGC 대표와 곽진영 시그마체인 대표.이원다이애그노믹스(EDGC)는 시그마체인, 유전체 기반 사회관계망서비스(SNS) 개발기업 마이지놈박스와 디지털신분증(DID) 개발에 착수한다고 31일 밝혔다.DID는 개인정보를 중앙 기관이나 기업이 관리하는 것이 아니라, 탈중앙화 방식으로 자신이 직접 관리하는 디지털신분증이란 설명이다. 인터넷에서 회원가입을 위해 아이디와 비밀번호, 이메일 주소나 휴대폰 번호를 입력하지 않아도 DID만 있으면 자신을 증명할 수 있다. 신분증이나 공인인증서도 필요없다. 암호키로 변환된 신상정보를 DID가 확인해주면 된다.EDGC는 기존 증명서의 발급과 제출, 인증 과정을 혁신하고 은행 카드 증권 보험 등 다양한 DID 인증산업 분야에 유후엔진을 접목해, 유전체 정보 기반 권리증명으로 디지털경제 기반(인프라) 선점에 나선다.DID는 디지털 비대면 경제의 핵심 기술로 떠오르고 있다고 했다. 마이크로소프트는 2018년부터 핵심 신규사업으로 디지털 인증사업에 집중하고 있다. 링크트인을 인수하는 등 DID 사업화를 가속 중이다. EDGC 컨소시엄은 디지털인증 방법에 유전체를 사용한다. 개인은 유전체를 이용한 DID를 통해 요구사항에 맞는 신원정보만 제공할 수 있어 불필요한 개인정보 노출을 줄일 수 있다고 했다. 기업은 개인정보를 직접 관리하지 않아도 되기 때문에 개인정보 유출이라는 위험에서 벗어날 수 있다는 것이다.EDGC는 싸이월드를 개발한 시그마체인의 블록체인 메인넷과 마이지놈박스 기술을 융합해, 유전체 정보를 DID에 이식함으로써 대체불가한 디지털 인증체계를 구축할 계획이다. EDGC의 유후엔진은 유전체 빅데이터를 기반으로 한다. 3사는 이번 협약(MOU)을 통해 국내는 물론 글로벌 30여개국에도 진출, 해외에서도 DID 기술을 접목한 신규 사업기회를 발굴키로 했다.시장조사기관 지온마켓리서치는 DID 시장이 연평균 80%씩 성장해 2024년 34억달러(약 4조177억원)를 형성할 것으로 전망했다.한민수 기자"
뛰는 JYP엔터 기는 SM엔터…엇갈린 엔터주들,2022-03-31 11:24,한국경제,"""기업가치 저평가""…주주행동 맞닥뜨린 SM주총 표결 앞두고 주가 급등락 반복JYP, 콘서트 재개·신인 수익화로 '상승세'한 달 새 시총 격차 확대돼사진제공=JYP엔터테인먼트국내 대표 연예계 기획사 두 곳의 희비가 엇갈리고 있다. JYP엔터테인먼트가 콘서트 재개와 저연차 아이돌 그룹들의 빠른 수익화 등 풍부한 상승 동력(모멘텀) 속에서 연중 신고가를 새로 쓰더니 시가총액에서 에스엠(SM엔터테인먼트)을 추월한 지 오래가 됐다. 반면 SM엔터는 매각이 막바지 진통을 겪고 있는 데다 기업가치 저평가 문제를 지적한 투자자의 주주행동까지 맞닥뜨리고 있다.31일 한국거래소에 따르면 이날 오전 10시29분 현재 코스닥시장에서 JYP엔터는 전일 대비 100원(0.16%) 오른 6만900원에 거래되고 있다. 시가총액은 2조1000억원을 넘기면서 코스닥 17위를 차지하고 있다. 같은 시간 에스엠은 800원(1.01%) 상승한 8만400원을 기록 중이다. 시가총액은 1조8800억원가량으로 22위를 지키고 있다.JYP엔터는 올해초부터 주가가 상승세를 타면서 에스엠을 바짝 따라 붙더니, 이제는 앞서가면서 격차를 벌리고 있는 형국이 됐다. 최근 한 달 해 시가총액 격차는 계속 벌어졌다. 이달 첫 거래일인 2일만 해도 시총 22위인 에스엠이 303억원 차이로 시총 21위인 JYP엔터와 큰 차이가 없었다. 이후 JYP엔터는 꾸준한 우상향 그래프를 그린 반면 에스엠은 주춤한 양상을 보였다.JYP엔터는 소속 아티스트들의 희소식이 주가를 견인하고 있다. 대표그룹인 트와이스는 일본에서 발표한 네 번째 베스트 앨범이 오리콘 주간 합산 앨범 랭킹 1위를 기록하는 등의 성과를 나타냈다. 공연소식도 꾸준하다. 오는 4월에 일본 도쿄돔에서 공연이 예정됐고, 지난 2월 미주 투어에 이어 오는 5월부터 다시 한번 미국을 찾아 앙코르 공연을 가진다. 최든 데뷔한 7인조 신인 걸그룹 '엔믹스' 또한 반응이 좋은 편이다.지난 23일 종가 기준으로 시총 2조원을 넘기더니 전일인 30일에는 그룹 스트레이 키즈의 '빌보드 200' 1위 소식이 전해지면서 장중 한때 연중 최고가인 6만2300원을 기록했다. 지난 1월27일 종가가 3만7600원인 점을 감안하면 주가는 두 달 만에 66% 급등한 셈이다.투자자별 수급을 살펴보면 개인은 지난 24일부터 순매수세를 보였다. 24일 37억원, 25일 18억원, 28일 3억원, 29일 15억원어치를 각각 사들였다. 다만 신고가를 경신한 30일에는 차익실현 등을 이유로 92억원가량을 순매도했다.최근 JYP엔터 주가는 작년 4분기 호실적을 시작으로 연간 100만명 수준의 월드투어 재개 시점이 뚜렷해지면서 상승세를 나타냈다. 여기에 내년 한국과 미국, 일본, 중국에서 각각 신인그룹이 한 팀씩 데뷔할 전망이어서 증권가는 최소 2024년까지 사상 최대 실적이 지속될 것이라고 보고 있다. 이런 이유로 이달 들어서만 증권사 5곳이 JYP엔터의 목표주가를 기존보다 높였다.이화정 NH투자증권 연구원은 ""기존 라인업의 콘서트 재개와 엔믹스 등 신인그룹의 빠른 수익화 등을 감안할 때 단기적인 실적 성장은 물론 구조적인 성장 가능성도 엿보인다""며 ""자사몰 전개와 미국 중국 등으로의 아티스트 육성 시스템 수출 시장 확대가 기대되기 때문""이라고 말했다.사진=SM엔터테인먼트 제공반면 에스엠 주가는 잔뜩 긴장한 상태다. 최근 고질적인 기업가치 저평가 문제를 두고 투자사인 얼라인파트너스자산운용이 주주행동에 나선 영향이다. 작년 말 기준 얼라이언스파트너스운용이 보유한 SM 지분은 0.21%(4만8500주)다. 특수관계자 지분인 0.70%(16만3194주)를 합산할 경우 지분율은 0.91%가 된다.얼라인파트너스는 SM의 이번 정기 주총을 앞두고 상법상 주주제안으로 감사(곽준호 KCF테크놀러지스 전 CFO) 선임 안건을 올렸다. 이사회의 독립성·전문성 결여가 SM엔터의 기업가치 저평가의 배경이라는 지적과 함께다. 같은 맥락에서 최대주주 개인회사인 라이크기획과의 프로듀싱 계약 해지를 골자로 하는 주주서한을 보내기도 했다.사측이 감사 후보로 임기영 한라그룹 비상근 고문을 추천한 만큼, 주총에선 양편간 팽팽한 표 대결이 이뤄질 전망이다. 감사위원 선임에 있어선 대주주 의결권을 3%로 제한하는 '3%룰'이 적용된다. 때문에 이수만 프로듀서가 18.48%의 압도적인 지분율을 보유하고 있더라도 얼라인파트너스운용이 승산 가능성이 점쳐질 수 있는 것이다.표결 결과에 따라 이날 에스엠 주가 방향성이 결정될 것으로 보인다. 주가는 이날 상승세로 개장했다가 이내 전일 대비 2.76% 떨어진 7만7400원까지 떨어졌다. 하지만 주총이 시작할 9시30분께 주가는 다시 상승세로 전환했다."
"[특징주] 덕산하이메탈, 100% 무상증자 소식에 상승세",2022-03-31 11:24,아이뉴스24,"덕산하이메탈이 무상증자에 나서자 주가가 상승세를 보이고 있다. 무상증자로 거래량이 늘면서 주가가 부양될 것이란 기대감이 반영된 것으로 보인다.31일 오전 11시 21분 기준 덕산하이메탈 주가는 전 거래일 대비 650원(3.49%) 오른 1만9천250원에 거래되고 있다. 오전 한때 9% 이상 급등세를 보였던 주가는 이후 상승폭을 다소 반납한 상태다.앞서 덕산하이메탈은 전날(30일) 보통주 1주당 신주 1주를 배정하는 100% 무상증자를 진행한다고 공시했다.무상증자로 발행되는 주식은 총 2천271만8천501주다. 증자 후 총발행주식수는 4천543만7천2주가 된다. 신주 배정 기준일은 4월 15일이며, 상장 예정일은 5월 4일이다. 신주 재원은 주식발행초과금을 사용할 예정이다."
[시그널] KCC·LX·현대百·호반까지…중견 그룹에 무슨일이?,2022-03-31 11:24,서울경제,"잇따른 M&A 통해 몸집 불리기 '본격화'LX인터, 한국유리공업 5925억 원에 인수호반, 수천억 현금 동원 한진칼 2대주주로현대百도 지누스 7747억에 사들여 눈길한국유리공업 군산공장 전경. 사진제공=LX인터내셔널[서울경제]LX·현대백화점(069960)·KCC(002380)·호반그룹 등 중견 대기업들이 잇따라 기업 인수·합병(M&A)을 전격 추진하거나 대규모 지분 투자에 나서면서 몸집을 불리고 있다. 이들 중견 그룹은 비대면·디지털·AI(인공지능) 등 시장 환경의 빠른 변화 속에 본업을 보강하면서도 외형을 확대해 재계 위상을 강화하려하고 있다.31일 투자은행(IB) 업계에 따르면, LX그룹 계열 종합 상사인 LX인터내셔널(001120)은 지난 30일 이사회를 열고 코리아글라스홀딩스가 보유한 한국유리공업 지분 100%를 5925억 원에 인수하기로 결정했다.한국유리공업은 ‘한글라스’라는 브랜드로 유명한 유리 제조업체다. KCC글라스에 이어 국내 유리 시장 점유율 2위를 기록하고 있다. LX인터내셔널은 한국유리공업 인수를 시작으로 소재 부문 시장 진출에 박차를 가한다는 입장이다.한국유리공업 인수는 LX그룹이 지난해 5월 LG에서 계열 분리를 한 이후 성사한 첫 인수합병(M&A)이다. 이번 딜을 계기로 LX그룹이 M&A에 적극 나설 것이라는 전망이 나온다. LX그룹의 물류 계열사인 LX판토스는 같은 날 사모펀드 운용사인 포레스트파트너스가 조성하는 펀드에 311억 원을 출자한다고도 밝혔다. 미주 지역 물류 기업 투자가 목적인 것으로 전해진다.지누스의 매트리스. 서울경제DB현대백화점그룹 역시 지난 22일 온라인 가구·매트리스 제조업체 지누스를 인수한다고 밝혔다. 지누스 창업주 이윤재 회장 등이 보유한 지분 30%를 7747억 원에 사들이는 거래다. 현대백화점그룹이 추진한 최대 규모의 M&A다. 지누스가 미국 아마존에서 매트리스 판매 1위를 기록한 바 있어 온·오프라인 유통망 강화를 통해 백화점 사업과 시너지를 내기 위한 인수였다는 분석이 나왔다.KCC 역시 최근 국내 벽지 ‘빅3’ 업체인 신한벽지 지분 100%를 약 1470억 원에 사들였다. 건자재 사업을 강화하면서 코로나19 이후 성장세가 두드러지고 있는 인테리어 시장 공략을 염두에 둔 것으로 알려졌다.호반건설은 지난 28일 KCGI가 보유한 한진칼 지분 17.41% 중 13.97%를 5640억 원에 인수하며 한진칼 2대 주주에 올랐다. 호반그룹은 KCGI의 남은 지분들도 사들일 계획을 가지고 있어 향후 항공업 진출 여부가 주목된다. 호반그룹은 이전에도 아시아나항공 인수 의사를 보인 바 있다.M&A업계의 한 관계자는 “중견 그룹들이 코로나19 이후 시장 환경 변화에 대응하기 위해 경쟁력 강화와 몸집 키우기에 높은 관심을 보이고 있다” 면서 “오너 집안의 계열 분리나 부자·형제간 회사 상속 등을 놓고도 이슈가 적지 않아 M&A로 돌파구를 찾는 사례도 적지 않다”고 설명했다."
"'유령주식 사태' 삼성증권 전·현 직원들, 대법서 유죄 확정",2022-03-31 11:22,뉴시스,"기사내용 요약2018년 삼성증권 '유령주식' 배당사고잘못 전달된 주식 매도한 혐의로 기소1·2심, 징역형 집유 및 벌금형 등 선고[서울=뉴시스] 김재환 기자 = 지난 2018년 잘못 입고된 주식을 매도한 혐의로 재판에 넘겨진 삼성증권 전·현직 직원들이 유죄를 확정받았다.대법원 3부(주심 노정희 대법관)는 31일 자본시장과 금융투자업에 관한 법률 위반 등 혐의로 기소된 구모씨 등 8명의 상고심에서 유죄를 선고한 원심을 확정했다.구체적으로 삼성증권 전 직원 구씨와 최모씨는 각각 징역 1년6개월에 집행유예 3년과 벌금 2000만원이 확정됐다.함께 재판에 넘겨진 이모씨와 전 팀장 지모씨는 징역 1년에 집행유예 2년과 벌금 1000만원을, 나머지 4명은 벌금 1000~2000만원을 확정받았다.이들은 지난 2018년 4월 삼성증권의 우리사주 배당 실수로 잘못 전달된 주식을 매도, 회사와 투자자에 피해를 입힌 혐의로 재판에 넘겨졌다.이른바 '유령주식 사태'로 불리기도 한 삼성증권의 배당오류 사고는 지난 2018년 4월6일 담당자의 전산 실수로 발생했다. 우리사주 1주당 1000원씩을 배당해야 할 것을 주당 1000주씩을 배당한 것이다. 결론적으로 존재하지 않는 약 28억주가 배당됐다. 사고 전날 종가(3만9800원)를 감안하면 시장가치가 112조원에 이르는 유령주식이 배당된 셈이다.사태는 일부 직원들이 배당받은 주식을 시장에 내놓으면서 '역대급' 금융사고로 비화했다. 사고 당일 오전 9시35분부터 10시6분 사이 직원 21명이 매도 주문을 했고, 여기서 16명의 501만주(약 1820억원) 주문이 체결됐다. 그나마 이 중 5명의 주문은 거래가 성사되지 않았다.이 여파로 삼성증권의 주가는 전일 종가 대비 최고 11.68%까지 떨어졌다. 개별 종목 주가가 일정 기준 이상 급변동할 경우 거래를 제한하는 변동성 완화장치(VI)가 7차례나 발동됐다. 투자자들의 혼란은 극심해졌고 실마리를 제공한 삼성증권 측은 사태 수습에 애를 먹었다.금융감독원은 잘못 입고된 주식임을 알면서도 매도 주문을 한 것으로 의심되는 직원 21명을 검찰에 고발했다. 이후 검찰은 금액이 상대적으로 적거나 계약 체결 직후 상사에게 보고하는 등 의도성이 적다고 보이는 13명은 불기소 처분했고, 나머지 8명을 재판에 넘겼다.1심은 ""이번 사건은 규모가 크고 주식시장에 준 충격이 작지 않다""며 ""타인의 자산을 관리하는 것을 본질로 해 돈에 관해 더욱 철저해야 할 금융업 종사자가 직업윤리와 도덕성에 대한 기본적인 신뢰를 배반해 엄중한 처벌이 필요하다""고 말했다.그러면서 전 직원 구씨와 최씨에게 각각 징역 1년6개월에 집행유예 3년을 선고했다. 이씨와 전 팀장 지씨는 징역 1년에 집행유예 2년을, 나머지 4명은 벌금 1000~2000만원을 선고받았다.2심은 이들에게 일부 벌금형을 함께 부과하는 한편, 유·무죄에 대한 1심 판단은 그대로 유지했다."
"현대삼호중공업, 5895억 규모 컨테이너선 4척 수주 계약",2022-03-31 11:21,헤럴드경제,[헤럴드경제=증권부] 한국조선해양은 자회사 현대삼호중공업이 라이베리아 소재 선사와 컨테이너선 4척 수주 계약을 체결했다고 31일 공시했다.계약금액은 5895억원으로 이는 2020년 매출 대비 15.05%에 해당하는 규모이다.계약기간은 2024년 11월 11일까지다.
"""개미 피눈물, 안랩뿐 아니다""…安 총리 고사에 관련주 '우수수'",2022-03-31 11:21,매일경제,"써니전자, 일주일새 36% 밀려까뮤이앤씨도 3일 연속 급락세안철수 인수위원회 위원장이 31일 오전 서울 종로구 통의동 대통령직인수위원회에 출근하고 있다. [사진 출처 = 연합뉴스]안철수 인수위원장이 차기 정부의 국무총리직을 맡지 않겠다고 공언하면서 관련주가 일제히 하락세를 보이고 있다. 안 위원장 테마주 중 대장주격인 안랩 뿐 아니라 써니전자와 까뮤이앤씨 등 관련주로 묶였던 종목들의 주가도 큰 폭으로 하락하면서 뒤늦게 뛰어든 투자자들의 손해가 커지고 있다.31일 오전 11시 5분 현재 써니전자는 전일대비 35원(0.99%) 내린 3505원에 거래되고 있다.써니전자는 이날 오전 장중 한때 2.68% 낙폭을 보이기도 했다. 써니전자는 지난 24일부터 이날까지 6거래일 연속 약세를 기록중이다. 지난 24일 5400원대였던 써니전자 주가는 현재 3400원 수준으로 내려왔다. 일주일새 약 36%가 밀린 것이다. 써니전자는 전 대표가 안랩 출신이라는 이유로 관련주가 됐다.까뮤이앤씨 역시 상황은 비슷하다. 같은 시간 까뮤이앤씨는 전일대비 0.85% 하락 중이다. 까뮤이앤씨는 지난 29일부터 이날까지 3일 연속 떨어지고 있다. 지난 29일 2%대 하락한데 이어 전날에는 6% 넘게 빠졌다. 지난 23일 장중 기록한 3545원과 비교하면 까뮤이앤씨도 일주일새 19% 밀렸다. 까뮤이앤씨는 표학길 사외이사가 안 위원장 지지모임의 상임대표를 역임하면서 관련주로 엮었다.전날 11.72% 급락 마감한 안랩은 이날 오전 오르락내리락 장세를 펼치고 있다. 이날 1%대 하락하며 출발한 안랩은 오전 장중 2% 넘게 상승하기도 했으나 곧 하락 전환하며 1%대로 낙폭을 키웠다. 현재는 낙폭을 축소하면서 0.33% 오름세를 보이고 있다.전날 안 위원장이 국무총리를 맡지 않고 당으로 복귀할 의사를 공식 선언하면서다. 안 위원장은 전날 서울 통의동 인수위 기자회견장에서 기자간담회를 열고 전날 자신이 윤석열 대통령 당선인을 만나 국무총리직을 맡지 않겠다는 의사를 밝혔다고 말했다.안 위원장은 ""인수위원장으로서 다음 정부에 대한 청사진과 좋은 그림의 방향을 그려드린 다음에 직접 내각에 참여하지 않는 게 오히려 당선인의 부담을 더는 것""이라며 ""당의 지지 기반을 넓히는 그런 일들, 또 정권이 안정될 수 있는 일들에 제가 공헌할 바가 많다""고 밝혔다."
'톤당 7.8만원->9만원->11만원?' 시멘트 쇼크···오르는 시멘트株,2022-03-31 11:20,머니투데이,"[[오늘의포인트]]러시아의 우크라이나 전쟁 여파로 유연탄 가격이 폭등한 데 이어 국내 건설현장에선 시멘트 수급난까지 겹쳤다. 유연탄 가격 급등은 시멘트업계에 부담이 되지만 시멘트 가격 인상이 이뤄질 경우 실보다 득이 클 거란 전망에 시멘트주가 강세를 보였다.31일 오전 11시10분 현재 코스피 시장에서 아세아시멘트는 전일대비 5500원(3.42%) 오른 16만6500원에 거래 중이다. 한일시멘트가 1.7%, 성신양회가 1.04% 오름세이며 한일현대시멘트와 삼표시멘트도 0.45%, 0.19% 상승하고 있다. 코스닥에서 고려시멘트도 1.84% 오르는 중이다.유연탄은 시멘트 원가에서 20~30% 비중을 차지하는 핵심 원료인데 전량 수입 중이다. 국내 시멘트 업체들은 강원도와 물리적 거리가 가깝고 가격이 저렴한 러시아산 유연탄을 주로 사용하고 있다. 2019년 톤당 200달러를 하회했던 유연탄 가격은 러시아의 전쟁 도발로 3월 들어 400달러를 돌파했다.시멘트업계는 유연탄 가격의 고공행진이 계속될 경우 원자재 비용 충격이 불가피할 것으로 전망한다. 신영증권 분석에 따르면 유연탄 가격이 톤당 10달러 상승할 때마다 국내 시멘트업계는 약 100억원의 비용을 추가 부담하게 된다. 다만 시멘트업계의 한 관계자는 ""유연탄 가격이 톤당 10달러 상승할 때마다 개별 시멘트 업체는 약 50~60억원의 비용이 추가 발생하고 시멘트 업계 전체가 부담하게 될 비용은 100억원이 아니라 500억원에 달할 것""이라고 설명했다.유연탄 가격 폭등에 국내 시멘트사들은 가격 인상을 시도하고 나섰다. 현재 국내 시멘트 고시 가격은 톤당 7만8800원이다. 시멘트업계는 2월 출하량부터 톤당 9만3000원의 인상안을 래미콘 및 건설업체를 상대로 제시한 바 있다. 하지만 최근 유연탄 가격이 재차 폭등하면서 인상안을 톤당 11만원으로 20% 추가로 올려줄 것을 제시했다.박세라 신영증권 연구원은 ""보수적으로 시멘트 가격을 톤당 1만원 올려서 8만8000원으로 고시 가격이 결정된다고 가정해도 시멘트업계의 평균 매출액은 15% 증가할 것""이라며 ""유연탄 가격이 톤당 10달러 오를 때마다 업계 비용이 100억원 증가하지만 가격 인상시 시멘트 출하량 상승과 인상 효과로 이익 레버리지(이익률이 크게 오르는 현상) 구간에 돌입하게 된다""고 분석했다.건설현장마다 시멘트 재고량이 바닥을 드러냈지만 시멘트 업계는 탄소배출 제한으로 가동률을 대폭 올리지 못하고 있다. 이에 따라 올해 출하량 증가폭은 3% 이내가 될 전망이다.박 연구원은 ""높은 유연탄 가격이 장기화될 경우 비용 부담이 커질 수 있어 절대 유연탄 사용량 절감 노력이 필요하다""며 ""2022년 탄소배출 무상할당량은 여유롭지 않은 상황으로 국내 시멘트 수요 증가에도 출하량을 늘리기 어려워 탄소배출 저감을 위한 투자는 필수""라고 부연했다.원재료인 유연탄 가격이 폭등한 가운데 유연탄 구입 시기 및 재고 비축량에 따라 업체별 실적은 엇갈릴 전망이다. 실제로 지난해도 유연탄 구입 시기에 따라 시멘트 업체별 실적 희비가 크게 갈렸다.아세아시멘트는 안정적인 유연탄 구입을 통한 원가 관리에 능한 모습을 보였다. 아세아시멘트는 유연탄 가격이 저렴했던 2020년 상반기에 유연탄을 대량 비축해 지난해 매출액이 10.5% 증가한 8699억원, 영업이익은 69.4% 늘어난 1275억원을 기록했다.반면 한일시멘트는 유연탄 가격에 취약한 모습을 보였다. 지난해 유연탄 가격 상승으로 영업이익이 1204억원으로 9.3% 하락하며 부진했으며 올해 1분기에도 그 여파가 계속될 전망이다. 한일현대시멘트도 유연탄 상승으로 지난해 영업이익이 359억원으로 37.1% 감소했다. 유연탄 구입 시점에 따라 영업이익 규모가 크게 달라졌던 것이다."
