제목,시간,언론사,본문
"헬릭스미스, 염증성 장질환 치료물질 ‘HX204’의 국내 특허 획득",2022-03-24 09:01,파이낸셜뉴스,"[파이낸셜뉴스]헬릭스미스가 염증성 장질환 예방 및 치료 후보물질 ‘HX204’의 국내 특허를 취득했다고 24일 밝혔다. 염증성 장질환은 원인불명의 중증 난치성 질환이지만, 현재 사용되고 있는 약물은 매우 제한적이고 부작용도 많다. 반면 HX204는 기존 약물 대비 안전성이 높은 식물들로 구성돼 있으며, 합성의약 만큼이나 효과가 있어 큰 기대를 모으고 있다.HX204는 헬릭스미스 천연물 연구팀이 개발한 식물성 복합추출물이다. 우수한 항염증 효과와 함께 장 내 밀착연접과 점액분비를 개선시키는 것으로 나타났다.염증성 장질환은 원인 불명의 장관 내 비정상적인 만성 염증이 호전과 재발을 반복하는 질환으로 궤양성대장염(UC, Ulcerative Colitis)과 크론병(CD, Crohn’s Disease)으로 분류하고 있다. 한 번 발병하면 만성화되는 특징으로 평생을 치료 및 관리가 필요한 질환이다. 1/3 환자가 10년 내 중증으로 발전하고 10~15%는 장절제술을 받게 된다.전세계 환자 수는 2016년 486만명으로, 미국이 약 30%(140만명)를 차지하고 있다. 국내에서도 서구화로 인해 환자 수가 큰 폭으로 증가하고 있는데, 건강보험심사평가원에 따르면 2014년 4만9593명에서 2018년 6만6267명으로 33% 급증한 것으로 알려져 있다.현재 가능한 치료 방향은 약물로 증상을 완화시킨 뒤 상태가 유지되도록 억제하는 것이다. 하지만 사용 가능한 약제의 종류가 많지 않고, 효과가 강력한 약제는 부작용 우려와 높은 약가의 문제가 있다.헬릭스미스 유승신 대표는 “염증성 장질환은 중증 난치성 질환으로 한 번 발병하면 지속해서 치료와 관리가 필요하다""며 ""장질환의 또 다른 종류인 장염이나 과민성대장증후군과는 달리 수개월에 걸쳐 증상이 나타나고 반복되는 특성이 있다""고 말했다.이어 “HX204는 기존 약물 대비 높은 안전성을 보이면서 동등한 수준의 치료 효능을 보이고 있는데, 이번 특허에서 염증성 장질환 치료물질로서 인정받은 만큼 기대가 크다""면서 ""현재 비임상 연구를 진행 중이며, 2022년 임상시험에 진입하고자 준비하고 있다”고 덧붙였다."
[출발]프로그램 66억 매도우위,2022-03-24 09:01,이데일리,"[이데일리 MARKETPOINT]09:00 현재 차익거래 41억 매도우위, 비차익거래 24억 매도우위"
[출발]코스피 하락..2716.25(-0.69%),2022-03-24 09:01,이데일리,[이데일리 MARKETPOINT]09:00 현재 코스피 하락..2716.25(-0.69%)
日증시 하락 출발..닛케이 27693.77(-1.24%),2022-03-24 09:01,이데일리,[이데일리 MARKETPOINT]09:00 현재 日증시 하락 출발..닛케이 27693.77(-1.24%)
[출발]환율 상승..1218.5(+4.7원),2022-03-24 09:01,이데일리,[이데일리 MARKETPOINT]09:00 현재 환율 상승..1218.5(+4.7원)
[출발]지수선물 하락..361.50(-2.75p),2022-03-24 09:01,이데일리,[이데일리 MARKETPOINT]09:00 현재 지수선물 하락..361.50(-2.75p)
"쓰리디팩토리, 서울시 초실감형 메타버스 5월 1일 오픈 예정",2022-03-24 09:01,서울경제,"[서울경제] 메타버스 플랫폼 전문기업인 쓰리디팩토리는 서울시 경제정책과(실물경제, 문화, 관광분야 등 연계)와 공간정보담당관(도시문제 해결을 위한 가상 서울 3차원 S-Map 플랫폼 연계, 홈페이지로 참여하고 서울기술연구원(초실감형 메타버스 기획연구 수행)과 맺은 “초실감형 메타버스 프로토타입 서비스플랫폼” 개발을 4월 중에 마치고 5월 1일부터 시범운영을 시작한다고 밝혔다. 이를 위하여 지식재산권 관리 관련사항도 관련규정에 따라 명확히 했다고 밝혔다.쓰리디팩토리 추성식 이사는 “서울시 초실감형 메타버스 프로토타입은 시·공간 제약없이 시민 모두가 누릴 수 있는 메타버스 플랫폼을 제공하고 메타버스 운영서비스 기준을 제시하기 위한 것으로 실사와 같은 수준으로 제작된 3D 공간정보(서울시청, 서울광장 등)와 서울시 주요정책의 가상 인프라 구축 및 경제활동을 연계하고, 서울시의 분야별 행정 서비스 구현을 위한 프로토타입 및 API(Application Program Interface)를 제공한다. 또한, 향후 서울시의 메타버스가 나아가야 할 발전방안 및 로드맵 공동 개발에 대한 내용도 포함한다. 위와 같은 도전적인 프로젝트의 성공적인 성과달성을 위해 작년부터 민간(쓰리디팩토리)-공공(서울시 수요처, 서울기술연구원)이 긴밀하게 협력해 왔다.”고 설명했다.쓰리디팩토리는 지난해 5월 과학기술정보통신부로부터 메타버스 분야에서 유일하게 미래 유니콘 기업으로 선정되었고, 10월에는 4차산업혁명대상에서 최고상인 과학기술정보통신부 장관상을 수상함으로써 실사기반 메타버스 시장에서 독보적인 성장성과 기술력을 증명하고 있다.지난 1월 31일에는 공식 팬 4억5천만명을 보유하고 있는 세계 최고 스포츠클럽 레알마드리드CF 메타버스인 RMVW(Real Madrid Virtual World)를 전세계에 오픈해서 베타(Beta) 운영을 시작했다."
"루트로닉, 올해 선진국향 매출 확대·멀티플 상향 기대-신금투",2022-03-24 09:00,파이낸셜뉴스,"[파이낸셜뉴스] 신한금융투자는 24일 루트로닉에 대해 올해 기존 제품 대비 ASP가 높은 프리미엄 제품의 선진국향 매출이 확대됨에 따라 외형 성장을 지속할 전망이라고 말했다. 투자의견 ‘매수’, 목표주가 3만2000원으로 커버리지를 개시했다.원재희 신한금융투자 연구원은 ""루트로닉은 공격적인 R&D 투자로 기존 저가 레이저 제품을 대체하는 프리미엄 레이저 제품군을 확대하며 선진국 진출의 기반을 마련했다""며 ""향후 해외 법인 영업 인력 확충은 선진국향 매출 가속화의 트리거가 될 전망""이라고 말했다.그는 ""지난해부터 프리미엄 레이저 제품군을 기반으로한 선진국향 매출이 본격화되며 전체 제품들의 평균단가 역시 상승하고 있는 것으로 판단된다""며 ""선진국향 매출 고성장세를 감안시 프리미엄 레이저 제품군의 ASP가 기존 제품 대비 1.5~2배 높아졌음에도 가격과 수량이 동반 상승하고 있는 것으로 해석된다""고 했다.국내 미용의료기기 업체 중 최대 매출 달성에도 불구하고 경쟁사 대비 낮은 멀티플을 적용받고 있다고 원 연구원은 지적했다.그는 ""올해는 연구개발비 상각 및 해외 법인 매출채권 대손 처리를 통해 투자 환기종목 지정이 해제된 만큼 멀티플 상향 조정이 이뤄질 것""이라며 ""향후 선진국 B2C 마케팅 확대를 통한 브랜드 이미지 제고 및 인지도 개선, 생산 캐파 확대를 통한 수요 대응 역량 강화까지 이뤄질 것을 감안 시 투자매력은 높다고 판단한다""고 말했다."
[출발]국채선물 상승..107.10 +13틱,2022-03-24 09:00,이데일리,[이데일리 MARKETPOINT]09:00 현재 국채선물 상승..107.10 +13틱
"NH證 ""코스피200 예상 편입 종목, F&F·에스디바이오·메리츠화재""",2022-03-24 08:59,뉴스1,"KOSPI 200 신규 편입 종목을 정기변경 3개월 전에 매수한 경우 15%p 초과수익KOSPI 200 지수 변경일은 6월10일© 뉴스1(서울=뉴스1) 손엄지 기자 = NH투자증권은 24일 코스피(KOSPI) 200 지수 6월 정기변경에서 6개 종목이 신규로 편입되고, 6개 종목이 제외될 것으로 예상했다.허율 NH투자증권 연구원은 ""KOSPI 200 지수의 6월 정기변경 심사대상기간은 2021년 11월1일부터 2022년 4월30일까지""라면서 ""현재 심사대상기간의 약 80%가 경과되어 교체 예상 종목의 윤곽이 드러났다""고 밝혔다.이어 그는 ""예상 편입 종목은 F&F, 에스디바이오센서, 메리츠화재, 일진하이솔루스, 케이카, 한일시멘트 등 6개 종목""이라면서 ""하나투어는 근소한 차이로 편입 조건을 충족하고 있지 못해, 남은 심사기간 동안 조건을 충족하며 편입될 가능성이 있다""고 설명했다.또 ""넥센타이어, SNT모티브, SK디스커버리, 부광약품, 영진약품, 풍산이 제외될 것으로 예상한다""면서 ""영진약품 대신 보령제약이, 풍산 대신 휴켐스가제외될 가능성도 있다""고 덧붙였다.KOSPI 200 지수 변경일은 6월10일이다. 한국거래소는 5월 중순에 정기변경사항을 발표할 예정이다. KOSPI 200 지수를 추종하는 상장지수펀드(ETF) 등의 패시브 자금은 6월9일에 리밸런싱을 진행한다.허 연구원은 ""지수 변경 이벤트는 초과수익을 창출할 수 있는 좋은 기회""라면서 ""2002년 이후 KOSPI 200 신규 편입 종목을 정기변경 1, 3개월 전에 매수한 경우 평균 약 7%포인트(p), 15%p의 초과수익을 거뒀다""고 말했다."
"""삼성SDI 원자재 가격 상승 리스크 크지 않아""",2022-03-24 08:58,서울경제,"[DB금융투자 보고서]목표가 92만원, 투자의견 '매수' 유지올해 연간 매출액 16.95조, 영업익 1.51조 전망사진제공=삼성SDI[서울경제]DB금융투자(016610)는 삼성SDI(006400)가 원자재 가격 상승 리스크에 성공적으로 대응할 것으로 전망했다. 이에 삼성SDI의 목표주가 92만 원과 투자의견 ‘매수’를 유지했다.24일 DB금융투자는 삼성SDI의 올해 매출액이 지난 해 대비 25.1% 증가한 16조 9520억 원을 기록할 것으로 내다뵀다. 같은 기간 영업이익은 42.3% 증가한 1조 5190억 원으로 추정했다. 권성률 DB금융투자 연구원은 ""여러 매크로 변수가 자동차 고객 생산 차질, 원자재 가격 변동성 확대 등으로 나타나고 있지만 사업별로 상쇄되어 당초 전망에서 크게 바뀐 게 없다""며 ""리튬, 코발트 등 6대 소재 비중이 90% 정도인데 가격 연동제 계약으로 보전되고 있어 원자재 가격 상승 리스크는 크지 않다""고 밝혔다.권 연구원은 ""유럽 자동차 고객의 생산차질이 플러그인하이브리드(PHEV) 등에서 발생하고 있지만 대신 전기차(EV) 생산 비중을 늘리며 물량 보전을 하고 있다""며 ""원형전지 내에서 EV용 비중도 올해 20% 이상으로 증가할 것이다""고 말했다. 그는 ""자동차 전지 캐파는 올해 20% 이상 늘어나는데 각형은 헝가리, 원형은 말레이시아에서 증설이 집중된다. 22년 매출액 성장률은 25%로 21년보다 더 클 것이다""고 전망했다."
"휴젤, ‘보툴렉스’ 영국 허가 획득…연내 유럽 11개국 진출 목표",2022-03-24 08:57,한국경제,"‘세계미용안티에이징학회’서 보툴렉스 첫 선휴젤은 영국 의약품규제청(MHRA)으로부터 미간주름을 적응증으로 보툴리눔 톡신 제제 ‘보툴렉스’(수출명 레티보) 50유닛의 품목허가를 획득했다고 24일 밝혔다.휴젤에 따르면 영국은 유럽 보툴리눔 톡신 시장의 70%를 차지하는 주요 5개국(영국 프랑스 독일 이탈리아 스페인) 중에서도 시장이 가장 크다. 올해 영국의 미용용 보툴리눔 톡신 시장은 약 1200억원으로 추정된다는 설명이다.회사 측은 “영국은 전체 인구의 7~10%가 보툴리눔 톡신 시술 경험이 있다”며 “다른 나라 대비 의료전문가(HCP)의 수가 많아 병원 등 외에도 신규 채널을 통한 보툴리눔 톡신 시술이 활발해 후발주자의 시장 진입이 용이할 것으로 예상된다”고 했다.2분기 내에 영국에 본격 진출해 유럽에서 시장 점유율을 확대한다는 계획이다. 이를 위해 제품 출시와 함께 보툴리눔 톡신 시술 수요가 높은 젊은층 중심의 영업을 진행한다.휴젤은 앞서 획득한 유럽의약품안전관리기구연합체(HMA)와 프랑스의 품목허가를 시작으로 연내 유럽 주요 11개국에 진출한다는 목표다.국가별 출시는 유럽 협력사인 오스트리아 의료미용 전문 제약사 크로마를 활용한다. 이를 통해 유럽에서 기업 및 제품 인지도를 높여갈 계획이다. 오는 31일부터 내달 2일까지 모나코에서 개최되는 ‘국제미용안티에이징학회(AMWC) 2022’에 참가해 유럽에 보툴렉스를 처음으로 선보인다. 현지 주요 인사를 대상으로 회의를 해 제품을 직접 소개할 예정이다.휴젤 관계자는 “영국은 유럽 최대 보툴리눔 톡신 시장으로 이번 허가 획득은 유럽에서 휴젤 입지 확대의 분수령이 될 것”이라며 “앞서 진출한 프랑스, 오스트리아와 함께 현지에 빠르게 안착해 내년까지 유럽 36개국 진출을 완료할 것”이라고 말했다.이도희 기자"
"한화투자증권 “한샘, 올해 1분기 실적 부진 예상…목표가 11만5000원으로 26% 하향”",2022-03-24 08:57,조선비즈,"한화투자증권이 24일 한샘(009240)에 대해 올해 1분기 영업이익은 시장 기대치를 밑돌겠으나 한샘이 들려줄 새로운 이야기를 기대해볼 시점이라고 평가했다. 이에 실적 추정치 변경을 반영해 목표가는 11만5000원으로 낮추는 한편, 투자 의견은 매수를 유지했다.한샘 로고.송유림 한화투자증권 연구원은 “한샘의 1분기 연결기준 매출액은 5259억원, 영업이익은 173억원으로 전년 동기 대비 각각 4.9%, 8.3% 낮아질 것”이라며 “영업이익은 시장 기대치인 227억원보다 24% 낮은 수치”라고 평가했다. 그는 “계절적 비수기인 것 외에도 거래량 급감, 원자재 가격 상승 등 비우호적 외부 환경에 시달리는 가운데 최대 주주 변경 직후 경영 전략의 재정비 시기로 온몸에 힘을 쭉 뺀 실적을 기록한 것으로 보인다”라고 분석했다.송 연구원은 “B2C(기업 소비자 간 거래) 부문은 대부분 두 자리수 내외의 매출 감소가 나타날 것으로 추정되는 한편 그간 수주를 가파르게 쌓아올린 B2B(기업 간 거래) 특판 매출은 순항이 예상된다”고 전망했다.다만 송 연구원은 영업환경의 변화와 새로운 경영전략 제시로 한샘의 실적 개선이 기대된다고 했다. 그는 “대선을 앞두고 극도로 경직된 주택 매매시장은 향후 부동산 관련 제도가 방향성을 잡아나가면서 활기를 되찾을 전망인데, 리모델링 시장을 정조준하는 한샘으로서는 수혜가 예상되는 부분”이라고 설명했다.이어 송 연구원은 “최대주주 변경으로 사업의 내용이나 방향성이 크게 달라지진 않겠으나 구체적인 실행 방안 등을 더한 새로운 전략이 궁금하기도 하고 필요하기도 한 시점”이라며 “3월 초 리하우스 제품에 대한 가격 인상 실시로 원가 부담도 일부 해소해나갈 전망”이라고 분석했다."
"""주가 왜 오른거야?""…올 들어 부진하던 밈주식 대반등",2022-03-24 08:56,한국경제TV,"올해 들어 약세를 면치 못하던 밈주식이 부활했다.23일(현지시간) 비디오게임기 소매체인 게임스톱과 영화관 체인 AMC엔터테인먼트는 각각 14.50%, 13.58% 뛰었다. 게임스톱은 이번 주 들어 60%, AMC는 30% 넘게 폭등했다.밈주식 주가 등락의 변동성이 극심한 만큼 상승과 하락의 배경을 파악하기 쉽지 않다.전날 CNBC는 게임스톱의 라이언 코헨 회장이 게임스톱 주식을 집중 매수했다는 소식을 주가 폭등의 배경으로 꼽았다. 코헨이 미국 증권거래위원회(SEC)에 제출한 자료에 따르면 그는 RC 밴처 캐피털을 통해 주당 최저 96.81달러에서 최고 108.82달러에 10만 주를 매수했다. 이같은 소식이 일부 커뮤니티에서 퍼지면서 이날 게임스톱 주가가 천정부지로 치솟았다는 것이다.CNBC의 유명 주식해설가 짐 크레이머는 게임스톱의 급등세에 중립적인 태도를 보였다.크레이머는 ""밈 주가 되돌아왔다. 개미투자자들이 기대감으로 우선 주식을 사들이고 있다""고 짚으면서도 ""아직 코헨 회장의 매수 계획이 구체적으로 나온 바가 없다""며 게임스톱 주가가 계속해서 고공행진을 지속할지 여부는 코언 회장이 구체적인 전환 계획을 공개한 뒤에야 판가름날 것으로 예상했다. 특히 게임스톱의 4분기 실적이 예상치를 하회했다는 점이 폭등세의 발목을 잡을 수 있다는 가능성도 열어뒀다.(AMC의 CEO 아담 아론 트윗 / 사진=Twitter)한편 AMC의 주가를 끌어올린 요인이 무엇인지는 알려지지 않은 상황이다.AMC 관련 소식으로는 15일(현지시간) 소규모 금광업체인 하이크로프트 마이닝 지분 22%를 2790만 달러에 인수했다는 것, 그리고 AMC의 CEO 애덤 애런이 올 봄과 여름 성수기 영화 개봉이 기대된다고 트윗을 올린 것 뿐이었다. 시너지 효과를 기대하기 어려운 투자이며 호재를 담은 트윗이 아니기에 직접적인 요인으로 보기 어렵다는 분석이다.주가 상승 요인이 분명하지 않은 만큼 폭등세에도 마냥 낙관할 수 없는 노릇이다.인터넷 세대들의 전유물인 밈은 인기가 붙는 속도도, 사그라드는 속도도 빠르다. 이러한 밈의 특성을 가진 주식에 붙여진 별명이 바로 '밈 주식'인만큼 투자자들이 삽시간에 몰렸다 급속도로 빠져나가는 등 변동성이 두드러진다.이러한 밈 주식을 두고 투자 리서치 회사 뉴컨스트럭트의 데이비드 트레이너 최고경영자(CEO)는 “밈 주식 투자는 무모하고 불필요한 위험을 수반한다. 투자자의 포트폴리오를 잠재적인 하락의 위험에 처하게 한다”고 지적하기도 했다."
"싸이월드, 애플 앱스토어 승인 완료…4월 2일 출시",2022-03-24 08:56,머니투데이,"싸이월드제트는 싸이월드 애플리케이션이 애플 앱스토어에서도 최종 승인을 받으면서 원스토어와 구글 플레이 등 3대 앱마켓에서 모두 승인을 받았다고 24일 밝혔다. 싸이월드는 오는 4월 2일 안드로이드와 ios 마켓에 동시 출시할 계획이다.싸이월드제트는 ""새로운 싸이월드는 싸이월드만의 진정성을 담는데 노력했다. 2040세대들에게는 편안한 SNS(소셜네트워크서비스)로, 아직 싸이월드를 접해보지 못한 MZ세대들에게는 가성비 좋은 SNS로 자리매김하겠다""고 말했다.싸이월드제트는 CBI와 NFT(대체불가토큰) 사업을 전개할 예정이다. 싸이월드제트는 ""싸이월드 회원 누구나 NFT창작자로 등재하는 서비스""라며 ""회원들이 자신의 추억의 사진을 NFT로 등록하고 도토리로 보상받는 NFT 대중화에 나선다는 계획이다""고 말했다.보상받는 도토리는 블록체인 환경에 맞춰 가상자산으로도 발행된다. 싸이월드 서비스 전면에 재화 도토리와 암호화폐 도토리를 배치하여 싸이월드의 새로운 보상형 이코노미를 만들어갈 예정이다.패밀리 코인으로는 코넌(CONUN)을 싸이콘(CYCON)으로 리브랜딩하기로 하고, 싸이월드 회원들이 '코넌 드라이브'를 사용하면 사용자들에게 가상자산 코넌을 지급하고, 다시 코넌으로 도토리를 구매할 수 있다.싸이월드제트는 ""4월2일 싸이월드 다운 새로운 싸이월드를 통해 블록체인과 SNS 가 융합된 새로운 서비스를 제시할 것""이라며 ""2021년 싸이월드는 블록체인 도토리와 함께하는 진화된 서비스, 돈버는 SNS로 돌아온다""고 덧붙였다."
"롯데백화점몰, '푸른 봄을 찾아서' 행사…골프·등산 제품 30% 할인",2022-03-24 08:56,서울경제,"나이키·아디다스 등 아웃도어 브랜드 참여골프의류와 용품부터 등산·러닝화 등 준비[서울경제]롯데온 내 롯데백화점몰은 이달 말까지 ‘푸른 봄을 찾아서’ 행사를 진행한다고 24일 밝혔다. 이번 행사는 봄을 맞아 나들이를 준비하는 고객을 위해 골프, 등산, 공원 등의 테마로 나눠 관련 상품을 최대 30% 할인 판매한다.이 행사는 나이키, 아디다스, 와이드앵글, K2 등 대표 아웃도어 브랜드들이 참여하며, 행사 상품 구매 시 사용할 수 있는 중복쿠폰 및 엘포인트 적립, 추가 카드 즉시 할인 등의 혜택을 제공한다.롯데백화점몰은 본격적인 골프 시즌을 맞아 골프 의류와 골프 용품을 준비했다. 최근 급격히 늘어난 여성 골퍼를 위해 소셜네트워크서비스(SNS)에서 인기를 끌고 있는 골프 의류 브랜드 ‘클랭클랑’의 긴팔 티셔츠 및 플리츠 스커트를 할인 판매한다. 헤지스골프 무빙캐디백과 와이드앵글 경량 캐디백, 1754클래식 미니 토트백 등 다양한 골프 용품도 할인된 가격에 선보인다.또한 등산을 좋아하는 고객을 위해 안전한 등산을 위한 트레킹화인 ‘K2 플라이하이크 큐브 2.0’을 비롯해 체온 유지에 도움을 주는 ‘블랙야크 고어텍스 방수 자켓’, 햇빛을 가려줄 ‘파타고니아 덕빌캡’ 등을 판매한다. 가까운 공원으로 산책을 나가는 고객에게는 ‘나이키 W에어맥스 97’, ‘아디다스 크랍 크루W’, ‘나이키 클럽 퓨추라 조거’ 등을 합리적인 가격에 준비했다.황형서 롯데온 백화점마케팅팀장은 ""낮 기온이 급격히 오르며 골프장, 산, 공원 등으로 나들이를 계획하는 고객이 많아지고 있다”며, “이번 기획전을 통해 인기 아웃도어 브랜드의 나들이 의류 및 용품 등을 합리적인 가격에 구매하길 바란다”고 말했다."
"인텔 CEO ""반도체는 석유 같아...공급량 줄면 경제 재앙""",2022-03-24 08:55,한국경제TV,"""인텔, 유럽에 향후 10년 동안 880억 달러 투입""""인텔 CEO, 520억 달러 규모 반도체 법안 처리 시급""펫 겔싱어 인텔 최고경영자(CEO)가 반도체 공급 확대의 중요성에 대해 강조했다.23일(현지시간) CNBC에 따르면 펫 겔싱어 CEO는 ""반도체는 마치 석유와 같다면서 앞으로 수십 년 동안 국제 관계에서 핵심적인 역할을 하게 될 것""이라고 밝혔다.이어서 ""반도체 공급량이 줄어들 경우 각종 경제 재앙이 찾아올 것""이라며 ""반도체 대란을 미연에 방지하기 위해 관련 산업에 대한 지원을 대폭 늘려야 한다""고 전했다.이날 겔싱어는 CNBC와의 인터뷰에서 그동안 석유가 국제 관계에서 중요한 역할을 해왔다고 전했다.겔싱어는 ""지난 50년 동안 석유 매장량이 지정학의 핵심 역할을 해왔지만, 최근 들어 시대가 변하고 있다""면서 ""앞으로 반도체가 석유보다 더 중요한 역할을 맡게 될 것""이라고 진단했다.이어서 ""인텔 역시 반도체 생산을 다각화하기 위해 최선을 다하고 있다""면서 ""지난해 애리조나주와 올해 오하이오주에 반도체 공장을 짓기 위해 각각 200억 달러를 투입했고, 유럽에는 앞으로 10년 동안 약 880억 달러를 투자할 예정""이라고 밝혔다.한편 겔싱어는 반도체 생산을 늘리기 위해 바이든 행정부의 적극적인 지원 정책이 필요하다고 강조했다.겔싱어는 ""글로벌 반도체 시장에서 미국이 전체 생산량의 약 12%를 담당하고 있는데, 이 중 무려 절반이 인텔에서 생산되고 있다""면서 ""미국의 반도체 생산량이 10% 이하로 떨어질 경우 회복 불가능한 지경에 이를 것""이라고 전했다.이어서 ""최악의 경우 미국이 중국과 대만 등 아시아 국가들에 영원히 의존할 수밖에 없는 상황이 연출될 것""이라며 ""이런 상황을 사전에 방지하기 위해 약 520억 달러에 달하는 반도체 지원 법안을 신속하게 처리해야 된다""고 밝혔다.또한 ""반도체 생산 확대를 통해 코로나19 사태 이후 발생한 반도체 공급망 병목 현상 등을 극복할 수 있을 것""이라며 ""다가올 경제 위기를 대비하기 위한 훌륭한 방파제 역할을 하게 될 것""이라고 덧붙였다.(사진=CNBC)"
