제목,시간,언론사,본문
[코인시황] 쉴새 없이 오른 비트코인 '숨고르기'…5600만원대 거래중,2022-03-31 08:59,뉴시스,"[서울=뉴시스] 김제이 기자 = 8일 동안 연속으로 상승세 마감한 비트코인이 이날 소폭 내리며 숨고르기에 들어갔다. 비트코인은 지난 8일 동안 5000만원에서 5700만원대까지 가격을 올리며 랠리를 이어나갔다. 테라폼랩스의 비트코인 매집 등의 호재성 소식으로 시장심리가 개선된 모습을 보였다. 다만 최근 연속 상승세와 더불어 블록체인 게임 엑시인피니티 해킹 소식으로 이날 내림세를 기록 중이다.31일 오전 8시55분 기준 국내 암호화폐 거래소 빗썸에서 비트코인은 24시간 전보다 0.62% 내린 5672만8000원을 기록했다. 같은 시각 업비트에서는 5664만2000원으로 0.60% 하락했다. 글로벌 암호화폐 시황 중계 사이트 코인마켓캡에서는 4만7114달러로 24시간 전보다 0.77% 내렸다.알트코인(얼터너티브 코인, 비트코인을 제외한 나머지 대체 암호화폐) 대장 이더리움은 보합권 사이에서 횡보를 보였다. 이날 같은 시각 이더리움은 빗썸과 업비트에서 407만원대에 거래되고 있었다. 코인마켓캡에서는 3391달러를 나타냈다. 이는 24시간 전보다 0.19% 떨어진 수준이다.연일 상승세를 기록하던 비트코인의 하락 전환은 8일 동안의 상승 후 숨고르기로 보인다. 아울러 지난해 P2E(Play-to-Earn, 플레이투언)게임 '엑시 인피니티'의 해킹 소식이 알려지면서 하락 전환한 것으로 풀이된다.엑시 인피니티 게임 개발사인 스카이 마비스는 ""해커들이 지난23일 게임 운영 네트워크인 로닌에 침입해 17만3600이더리움과 2550만달러(약 310억원)의 스테이블 코인(USDC)을 탈취했다""고 밝혔다.도난 당시 암호화폐의 가치는 5억4000만달러 상당이었으나, 현재는 6억1500만 달러(약 7454억원)로 가치가 증가했다.엑시 인피니티는 베트남 개발사 스카이마비스가 2018년 출시한 P2E 게임이다. 삼성전자 자회사 삼성넥스트가 1800억원 규모의 투자를 한 회사로, 지난해 기준 일 최대 170만명의 이용자를 기록하기도 했다. 유저들은 엑시라는 NFT(대체불가토큰) 형태의 디지몬을 수집해 양육과 전투를 벌이며 리워드(보상)을 받을 수 있다.이용자들은 게임 내에서 엑시를 다른 사람들과 전투 및 거래를 할 수 있다. 이를 기반으로 가상 자산을 구매·판매할 수 있다．또 러시아와 우크라이나 간 평화 협상의 제자리 걸음 상태와 독일의 비상가스 공급계획 발표로 경기 불안 우려가 고조된 것도 전반적인 투자심리 위축 요인으로 작용했다.한편, 암호화폐 데이터 조사 업체 얼터너티브(Alternative)에 따르면 이날 암호화폐 시장의 투자심리를 알려주는 '공포·탐욕 지수'는 55점으로 '탐욕적인(Greed)' 수준으로 나타났다. 이는 전날(56점·탐욕적인)과 비슷한 수준을 유지했다.해당 지수는 0으로 갈수록 시장 심리가 극단적 공포에 가까움을 나타내며, 100에 가까울수록 극단적 낙관을 의미한다."
"[머니팁] 삼성운용, ‘삼성OCIO솔루션’ 공모펀드 2종 출시",2022-03-31 08:59,이데일리,"[이데일리 김윤지 기자] 삼성자산운용은 최근 DB형 퇴직연금을 도입한 기업을 중심으로 관심이 높아지고 있는 OCIO 자산배분 전략을 적용한 ‘삼성OCIO솔루션 성장형 펀드’와 ‘삼성 OCIO솔루션 안정형 펀드’ 2종을 출시했다고 31일 밝혔다.삼성OCIO솔루션 펀드 시리즈는 OCIO(Outsourced Chief Investment Officer, 외부위탁 최고투자 책임자) 개념을 퇴직연금에 접목한 공모펀드다. OCIO는 연기금, 대학 등 투자자들로부터 자산운용 업무를 위탁 받아 운용하는 서비스다.이 펀드 시리즈는 연기금 및 대학기금 등에서 활용하는 자산배분 방식을 적용했다. 퇴직연금 확정급여형(DB) 자금 특성을 반영하여 목표수익률을 설정하고 자산군 별 기대수익률과 위험, 상관관계 등을 고려해 최적의 자산배분안을 도출했다. 목표 수익률에 따라 ‘성장형’과 ‘안정형’이 있으며, 각각의 목표 수익률은 연 5.0%와 연 3.5%이다.또한 삼성자산운용은 지난 2019년 7월, 국내 최초로 출시한 DB형 OCIO 공모펀드인 ‘삼성퇴직연금TLF7펀드’를 ‘삼성퇴직연금OCIO솔루션밸런스펀드’로 변경했다. 이 펀드는 KOSPI200 편입 기업의 퇴직부채 듀레이션을 고려해 국내 채권 듀레이션 7년을 기준으로 운용했으나, 최근 금리 시장환경에 따라 안정적이고 탄력적인 운용을 위해 듀레이션 범위를 4년~8년으로 확대했다. 이 펀드는 지난 1월 설정액 1000억원을 돌파했다.오태호 삼성자산운용 OCIO컨설팅본부장은 “300인 이상 사업장을 대상으로 시행될 근로자퇴직급여보장법에 맞춰 출시한 상품으로, 20년 넘게 운용 중인 연기금 OCIO 경험과 우수한 성과를 시현 중인 대학기금과 기업들의 OCIO 성공모델을 접목시켰다”며 “이 상품을 통해 퇴직연금 DB형 자금도 연기금 수준의 서비스를 받으며 장기적으로 안정적인 성과를 거둘 것으로 예상한다”고 밝혔다."
"SK하이닉스, ARM 공동인수 검토 관련 조회공시",2022-03-31 08:57,뉴시스,[서울=뉴시스] 김경택 기자 = 한국거래소는 SK하이닉스에 ARM 공동인수 검토 보도에 관해 31일 조회공시를 요구했다. 답변 시한은 이날 오후 6시까지다.
"인디제이, 신한금투와 코스닥 IPO 위한 주관사 계약",2022-03-31 08:57,한국경제,"2024년 상장 목표올해 동남아 등 해외 시장 진출이 기사는 03월 30일 17:27 “마켓인사이트”에 게재된 기사입니다.인공지능(AI) 기반 음악 추천서비스를 제공하는 인디제이가 신한금융투자와 코스닥 상장을 위한 대표 주관사 계약을 체결했다.30일 인디제이는 2024년 상장을 목표로 신한금융투자와 대표 주관 계약을 체결했다고 밝혔다. 인디제이는 이번 계약을 계기로 지속성장이 가능한 경영 체계를 구축한다는 전략이다. 신한금융투자는 상장 주관 업무 이외에도 자기자본 투자(PI)를 통해 인디제이에 프리IPO(상장 전투자)에도 나설 계획이다.인디제이 서비스는 사용자 선호뿐만 아니라 상황과 감정을 자동으로 분석해 맞춤형 음악 플레이리스트를 추천하는 플랫폼이다. 인디제이의 AI 기술은 단순히 사용자가 선호하는 장르뿐만 아니라 사용자 상황이나 감정 패턴을 파악해 상황별, 감정별 맞춤 음악을 추천한다. 또한, 인공지능 라벨링 시스템을 기반으로 음악의 복합감정, 세부 장르 및 악기 구성, BPM과 소셜네트워크 데이터를 분석하여 이를 추천에 반영한다.최근 코로나 확산세와 디지털 뉴딜 사업으로 인해 급격하게 커진 인공지능 시장에서 20만건 이상의 다운로드를 달성했다. 회사의 콘텐츠 추천 시스템은 계절이나 날씨 등 환경조건 감지뿐만 아니라 사용자의 운전습관, 운전상황 및 출근길, 여행 등 사용자의 세부적인 상황을 분석해 음악을 추천해준다. 이런 이유로 테슬라, BMW 등 다수의 자동차 회사들이 인디제이 기술 도입을 검토하고 있다.인디제이는 올해부터 해외 진출을 본격화한다. 베트남, 인도네시아 등 동남아를 적극적으로 공략할 예정이다. ARIS 솔루션, ME MOBIL, ASPEKTI 등 현지 통신사 등과 업무협약을 마쳤다. 정우주 인디제이 대표는 “지금까지 구축해온 상황·감정 데이터와 인공지능 기술 노하우 및 시장에서의 영향력을 바탕으로 목표한 2024년 상장 일정에 차질이 없도록 준비할 예정이다”라며, “지금 제공하는 서비스에 자율주행 자동차 등 미래자동차를 위한 상황 분석 및 AI 콘텐츠 추천시스템 등을 제공하여 국내뿐만 아니라 세계에서 인정받는 기업이 되겠다”라고 말했다."
"美 ""푸틴 주변엔 가짜뉴스 투성...두려워 제대로 보고도 못해""",2022-03-31 08:56,한국경제TV,"블라디미르 푸틴 대통령이 우크라이나 사태에 대한 제대로 된 정보를 보고받지 못하고 있는 것으로 드러났다.30일(현지시간) 뉴욕포스트는 ""미국 정보 당국의 기밀 자료에 따르면 푸틴이 이번 전쟁이 어떻게 진행되고 있는지 전혀 모르고 있는 것으로 확인됐다""면서 ""푸틴을 두려워하는 참모진이 거짓 정보를 계속 전달하고 있다""고 전했다.이날 뉴욕포스트는 미국 정보 당국의 기밀 자료를 인용하며 푸틴이 참모진의 거짓 뉴스에 둘러싸여 있다고 밝혔다.뉴욕포스트는 ""푸틴이 우크라이나 사태 이후 러시아 경제가 얼마나 망가졌는지 전혀 모르고 있다""면서 ""러시아 경제가 아직 전쟁 이전 수준을 유지하고 있는 것으로 믿고 있다""고 전했다.이어서 ""경제뿐만 아니라 전쟁에 대한 정보도 제대로 보고 받지 못하고 있다""면서 ""러시아군이 우크라이나군을 상대로 연일 압도하고 있는 것으로 알고 있다""고 밝혔다.한편 존 커비(John Kirby) 국방부 대변인도 언론 브리핑을 통해 이날 공개된 정보 당국의 기밀문서가 사실이라고 강조했다.존 커비는 ""우크라이나 사태 이후 푸틴의 보복을 두려워하는 참모들이 푸틴에게 거짓 정보만 전달하고 있다""면서 ""러시아군이 전쟁에서 얼마나 안 좋은 성과를 내고 있는지, 서방국가의 제재로 러시아 경제가 얼마나 무너졌는지 전혀 모르고 있다""고 전했다.이어서 ""푸틴이 우크라이나 사태에 대한 진실을 듣게 됐을 때 어떤 반응을 보일지 모르겠다""면서 ""거짓 정보만 보고받고 있는 지금 상황이 상당히 당황스럽다""고 밝혔다.또한 ""전쟁이 어떻게 돌아가고 있는지, 러시아가 어떤 상황에 놓였는지 전혀 모르고 있는 상태에서 어떤 합의가 이뤄질 수 있는지 의문""이라며 ""푸틴 개인이 일으킨 전쟁인 만큼 그가 이번 사태에 대한 모든 책임을 져야 한다""고 덧붙였다.(사진=뉴욕포스트)"
"""카카오뱅크, 새 정부 출범에 따른 정책 수혜주로 부각""-키움",2022-03-31 08:56,한국경제,"투자의견 아웃퍼품, 목표가 5만7000원 제시서울 영등포구 여의도 카카오뱅크 오피스 모습. /사진=뉴스1키움증권은 31일 카카오뱅크에 대해 새 정부 출범에 따른 정책 변화로 수혜를 입을 것으로 봤다. 이에 투자의견 '아웃퍼품'(시장수익률 상회)와 목표가 5만7000원을 제시했다.서영수 키움증권 연구원은 ""카카오뱅크는 국내 상장은행 중 가장 높은 경쟁력을 확보한 은행""이라며 ""차별화된 마케팅 능력을 통해 가장 인기 있는 앱을 확보하고 있으며, 온라인 서비스만 특화해 가장 우수한 비용 경쟁력을 구축하고 있다""고 말했다.서 연구원은 ""그럼에도 금융당국의 대출 총량 규제 도입, 금융소비자보호법 강화, 중금리 대출 한도 규제 도입 등 금융 안정을 위한 다양한 규제로 영업이 상당한 제약을 받아왔고, 이는 성장에 결정적 제약 요인이었다""고 분석했다.그는 이어 ""새 정부가 정책 기조를 금융 안정에서 주택시장 활성화 중심으로 정책기조를 변경, 이에 따라 카카오뱅크가 가장 많은 수혜를 입을 것""이라며 ""금융당국은 이미 대출 총량 규제를 사실상 해제했으며, 가장 경쟁력있는 상품은 전세자금대출 규제를 해제한 바 있다""고 설명했다.새 정부가 중금리 대출 규제까지 완화한다면 충분한 자본을 이용해 대출을 늘려 카카오뱅크가 차별적인 이익 성장을 달성할 것이란 설명이다.다만, 금융 안정 위험인 높아지는 상황에서 새 정부가 정책 기조를 전면 수정하거나 주택시장부양을 위해 모든 대출 규제를 완화한다고 단정하기는 어렵다. 서 연구원은 ""향후 금융 안정 위험 변화, 정책적 변화에 대응한 관점에서 접근할 필요가 있다""고 말했다."
"현대차證 ""LG엔솔, 원동형 전지 빠른 성장 기대…목표가 64만원""",2022-03-31 08:55,뉴스1,"LG에너지솔루션 예상 실적(현대차증권 제공) © 뉴스1(서울=뉴스1) 손엄지 기자 = 현대차증권은 31일 LG에너지솔루션에 대해 원통형 전지 사업이 빠르게 성장할 것이라며 '매수' 의견과 목표가 64만원을 유지한다고 밝혔다.강동진 현대차증권 연구원은 ""원통형 전지 주요 고객의 시장 지배력이 점차 높아지고 있어, LG에너지솔루션 역시 빠른 성장을 이어갈 것""이라면서 ""점차 원통형 배터리 비중이 높아질 전망""이라고 판단했다.현대차증권은 LG에너지솔루션의 올해 1분기 매출은 전년 대비 0.8% 오른 4조3000억원, 영업이익은 54% 감소한 1568억원을 기록할 것으로 예상했다. 자동차용 파우치 전지 수익성이 반도체 수급 이슈 등으로 부진했지만, 원통형 전지 호조가 이를 만회했다는 분석이다.강 연구원은 ""경쟁력 있는 신규 전기차(EV) 발매로 배터리 공장 가동률 높아지며 수익성 개선으로 이어질 전망""이라면서 ""LG에너지솔루션 실적은 계절적으로 1분기가 저점으로, 매분기 개선될 것""이라고 내다봤다.그러면서 ""2023년부터 미국 공장을 가동하면 시장점유율 회복의 발판이 될 전망이고, 이는 주가 프리미엄을 정당화하는 요인이 될 것""이라면서 ""주가는 우상향을 예상한다""고 판단했다."
"신한금융투자 “녹십자, 신규 플랫폼 확보로 외형성장 기대”",2022-03-31 08:55,조선비즈,"혈액분획 제제 IVIG-SN 10% 미국 허가 모멘텀 주목신한금융투자는 녹십자(006280)에 대해 31일 기존 판매제품 이외 희귀질환 목표 혁신신약 파이프라인, mRNA 등 신규 플랫폼 확보를 통한 외형 성장이 기대된다며 투자의견 ‘매수’, 목표주가 24만원을 제시했다.녹십자는 혈액제제·백신 전문 제약사다. 지난해 발생매출 기준으로 혈액제제와 백신이 50% 이상을 차지했다. 이어 처방의약품, 일반의약품 등도 판매한다. 코로나19 치료제 개발 포기, 얀센 백신 위탁생산 논의 중단 등 악재가 겹치면서 최근 녹십자 주가는 약세를 보이고 있다.정재원 연구원은 “단기적인 관점에서 매출 상승 모멘텀은 혈액제제 IVIG-SN 10% 미국 진출 여부”라며 “FDA(미국 식품의약국)은 지난 2월 CRL(최종보완요구서)을 통보했는데, 올해 BLA(신약허가신청서)를 제출하면 내년 허가 획득에 이어 2024년 미국 출시가 가능할 전망이다”고 내다봤다.정 연구원은 “중장기적 관점에선 녹십자가 개발 중인 희귀질환 혁신신약 확보와 자체 판매제품을 통한 외형 성장이다”며 “헌터라제, 다비듀오 등 기존 판매제품들의 판매 채널 확대, 품목허가 획득 등 긍정적 소재로 외형이 점진적으로 성장하고 있다”고 내다봤다.그는 “올해 연결기준 매출액은 전년 대비 7.1% 늘어난 1조6470억원, 영업이익은 26.7% 성장한 934억원이 예상된다”며 “백신 수주 등 추가 이벤트를 제외한 본래 사업만 고려한 보수적인 가정이어서 추가적인 실적 상승 모멘텀도 기대된다”고 덧붙였다."
"카카오뱅크, 尹정부 규제 완화 수혜…목표주가 5만7000원 -키움證",2022-03-31 08:53,머니투데이,"카카오뱅크키움증권이 카카오뱅크에 대해 목표주가 5만7000원과 '시장수익률 상회'(outperform) 의견을 제시했다. 윤석열 대통령 당선인 선출로 금융 규제 완화 움직임이 예상되는 가운데 카카오뱅크가 수혜주로 떠오를 것으로 내다보면서다.31일 서영수 키움증권 연구원은 ""카카오뱅크는 국내 상장은행 중 가장 높은 경쟁력을 확보한 은행""이라며 ""차별화된 마케팅 능력을 통해 가장 인기 있는 앱을 확보하고 있으며 온라인 서비스만 특화해 가장 우수한 비용 경쟁력을 구축해 업계 최고 수준의 가격(금리)을 고객에게 제공하고 있다""고 평가했다.이어 ""금융당국의 대출 총량 규제 도입, 금융소비자보호법 강화, 중금리 대출 한도 규제 도입 등 금융 안정을 위한 다양한 규제로 영업이 상당한 제약을 받아왔고 성장에 결정적 제약요인이었다""며 ""새 정부가 정책 기조를 금융안정에서 주택시장 활성화 중심으로 정책 기조를 변경한다면 카카오뱅크가 가장 많은 수혜를 입을 것""이라 했다.아울러 ""금융당국은 이미 대출 활성화를 위해 대출 총량 규제를 사실상 해제했으며 가장 경쟁력 있는 상품인 전세자금대출 규제를 해제한 바 있다""며 ""나아가 중금리 대출 규제까지 완화한다면 충분한 자본을 이용해 대출을 늘림으로써 차별적 이익 성장을 달성할 것""이라 내다봤다.다만 ""금융 안정 위험이 높아지는 상황에서 새 정부가 정책 기조를 전면 수정하고 주택시장부양을 위해 모든 대출 규제를 완화한다고 단정하기는 어렵다""며 ""따라서 향후 금융 안정 위험 변화와 이에 따른 정책적 변화에 대응한 '단기매수'(trading buy) 관점에서 접근이 필요하다""고 덧붙였다.한편 전일 종가 기준 카카오뱅크 주가는 5만300원이며 시가총액은 23조9005억원이다."
에디슨EV “사채권자 협의 통해 계속기업불확실성 사유 해소”,2022-03-31 08:53,이데일리,"[이데일리 박정수 기자] 코스닥 시장 퇴출 위기에 직면한 에디슨EV(136510)가 사채권자와 협의를 통해 계속기업불확실성의 원인 사유를 해소하겠다고 밝혔다.31일 에디슨EV는 보도자료를 통해 “현재 감사보고서 상 계속기업불확실성 사유로 지적된 전환사채 및 신주인수권부사채 총 발행금액 800억원 전액에 대해 현재 사채를 보유하고 있는 전체 사채권자와 협의를 통해 계속기업불확실성의 원인 사유를 해소할 예정이다”고 전했다.앞서 지난 30일 한국거래소 코스닥시장본부는 에디슨EV가 전날 감사보고서 감사의견이 계속 기업 존속능력에 대한 불확실성으로 인한 의견거절이 나옴에 따라 동일 감사인의 사유 해소 확인서 제출 시까지 주권매매거래가 정지된다고 공시했다.에디슨EV는 오는 4월 11일까지 감사인의 사유 해소에 대한 확인서를 제출해야 한다. 거래소는 사유 해소에 대한 확인서를 제출하지 못하는 경우 코스닥시장상장규정에 따라 상장폐지 사유에 해당한다고 전했다.이에 대해 에디슨EV 측은 “4월11일까지 사채권자 전체와 협의가 이루어져 사채인수계약서 상의 기한이익상실 사유를 변경, 삭제함으로써 계속기업불확실성 사유가 해소됐다는 감사인의 사유해소 확인서를 거래소에 제출하는 경우 감사의견은 수정될 수 있을 것으로 예상된다”고 설명했다.한편 에디슨EV가 최근 인수한 관계회사 유앤아이(056090)는 이날 정기 주주총회를 열고 상호를 ‘에디슨이노(Edisoninno)’로 변경할 예정이다.유앤아이는 또 신사업으로 전기자동차 관련 사업부문을 대폭 강화한다. 전 기아자동차 재무담당 부회장 출신의 한천수 에디슨EV 부회장이 유앤아이 대표이사를 맡아 전기자동차 사업부문을 역점적으로 키울 전망이다."
"""글로벌 변수에 출렁이는 반도체 업황…개별 실적 봐야""",2022-03-31 08:52,이데일리,"한화투자증권 보고서[이데일리 이은정 기자] 금리 인상과 인플레이션, 우크라이나 전쟁이 메모리반도체 업황을 둘러싼 가운데 실적 컨센서스 상향 여부를 보고 종목별로 접근해야 한다는 의견이 제시됐다. 반도체 장비·소재 기업은 하반기 투자 결정이 가시화되는 시점이나 밸류에이션 저점 때 접근이 유효하단 판단이다.이순학 한화투자증권 연구원은 31일 “지난 2년간 IT 수요가 예상치 않게 좋다보니 올해는 수요가 다소 둔화될 것이라고 예상했고, 공급자들은 이를 반영해 준비하고 있었다”며 “하지만 금리 인상과 인플레이션이 빠른 속도로 발생하더니 우크라이나 전쟁까지 터지면서 수요 방향성, 공급망 문제 등을 예측 불가능한 상황이 됐다”고 말했다.반도체 업계 생산차질은 지속되고 있다. 일부 대형 공급사들의 공장이 중단되는 등 문제가 발생했다. 글로벌 빅5 장비 업체들은 부품이 부족해 주문에서 출하까지의 리드 타임이 증가하고 있다고 설명한다. 노광 장비 분야에서 압도적 1위인 ASML 공장에도 문제가 발생해 반도체 기업들은 장비를 받기 위해 대기하는 점을 짚었다.이에 메모리 가격은 상승하지만 투자결정은 하반기로 이연되고 있다. 메모리 가격은 예상보다 빠른 시점에 상승 반전하고 있다. 수요는 생각보다 나쁘지 않은 가운데, 공급 쪽 문제가 더욱 크게 불거지고 있기 때문이다. 메모리 가격이 상승하면 통상적으로 공급사들은 캐파 투자를 진행한다. 하지만, 불확실한 매크로 변수가 너무 많아 당장 투자 결정을 내리기 어려운 상황이란 설명이다.아울러 상반기 반도체 장비 업체들의 실적은 전반적으로 약세를 전망했다. 지난 2년 간은 상고하저의 실적 패턴이었다면 올해는 상저하고가 나타날 것으로 봤다. 주가도 이를 반영해 저점 수준에 머물고 있다. 하지만 연간으로 보면 고객사의 설비 투자 축소는 제한적일 것으로 관측했다.이 연구원은 “15나노 수준의 디램 미세 공정은 수율을 확보하기가 어렵고, 하반기 DDR5 생산이 본격화되면 생산 로스(Loss) 부분을 메워줄 투자도 필요하다”며 “낸드도 올해 시장 빗그로스를 30% 안팎으로 낮게 보고 있어 이보다 수요가 높아진다면 뒤늦게 투자가 확대될 여지가 높다”고 전했다. 이어 “단위 캐파당 설비 매출이 늘고 있고, 부품A/S 매출액이 꾸준히 증가한다는 점도 긍정적”이라고 덧붙였다.결론적으로 당장은 메모리 제품 가격 인상과 그로 인한 양대 반도체 기업의 실적 컨센서스 상향을 고려해 소자 기업을 매수할 것을 조언했다. 이 연구원은 “이에 부합하는 SK하이닉스(000660)를 최선호주로 제시한다”며 “반도체 장비 및 소재 기업은 하반기 투자 결정이 가시화되는 시점 혹은 밸류에이션 저점에서 매수하는 것을 추천한다”고 말했다."
