제목,시간,언론사,본문
[초동시각] '나라님' 랠리 시작될까,2022-03-24 11:30,아시아경제,"윤석열 대통령 당선인이 22일 서울 종로구 통의동 대통령직인수위원회에서 열린 인수위 간사단 회의에 참석, 발언을 마친 후 굳게 입을 다물고 있다./윤동주 기자 doso7@‘윤석열’ 랠리는 언제 시작될까요?증시가 오르지 않는 것도 ‘나라님(대통령) 탓’인가 싶다. 그런데 이번 대선은 조금 달랐던 것이 사실이다. 지난 2020년 코로나19로 인해 코스피가 1400까지 빠지면서 일어난 동학개미운동으로, 개인투자자가 1000만명까지 늘면서 이들을 달래기 위한 공약들이 쏟아졌다. 특히 치솟는 부동산 가격에 증시로 눈을 돌린 20~30대 투자자들을 잡기 위한 공약들이 많았다. 이 중 윤 당선인은 자본시장 투명성 강화, 개인투자자 보호, 주식 세제 현실화, 물적 분할제 개편 등 개인투자자 보호를 위한 공약을 내놨고 대권을 잡게 됐다.이중 주식 양도소득세 폐지 여부가 큰 관심사다. 현행 대주주(코스피 1%, 코스닥, 코넥스 2%, 비상장사 4% 또는 단일종목 기준 10억원 이상의 보유자)에 한해 22~33%의 양도세가 부과되는데, 내년부터는 누구라도 연간 5000만원 이상 차익에 대해 20%(과세 대상 수익 3억원 이하)나 25%(3억원 초과)의 양도세를 내야 한다. 만약 이 법이 예정대로 시행된다면 ‘소득이 있는 곳에 세금이 있다’는 원칙은 지킬 수 있다. 하지만 수익률에는 큰 영향을 미치게 된다. 증권가에서는 지난 2000년 이후 코스피와 미국 S&P500 연평균 수익률이 각각 8.4%, 7.1%인데, 양도세(22%)를 낸다고 보면 코스피 수익률은 4.6%까지 내려간다고 본다. 이에 따라 투자자 수급에 영향을 줄 것이라는 전망이 나온다.그렇다고 단박에 이를 막을 수 있는 건 아니다. 과세가 예정된 소득 범위에서 주식에 대한 수익만 제외하거나, 관련법(금융투자소득세법) 자체를 폐기하고 현재 시행 중인 대주주 과세 제도를 폐지하는 방식이 예상되는데, 둘 다 과세 형평성에 어긋난다. 방식을 정한다고 해도 주식 양도소득세의 전면 폐지가 이뤄지면 지배주주는 이를 활용한 편법 승계 에 활용할 수 있다. 독점적 지위를 가진 회사에 일감을 몰아주기를 진행하고 부를 이전한 뒤 주식 매도를 통해 현금화 하는 식의 승계 방식이 만연해질 수 있다. 이 같은 시장 왜곡을 막기 위한 대안도 마련해야 한다.방식과 대안까지 정했다고 해도 당선인의 의지처럼 법 개정 절차가 잘 되면 좋은데, 여야 간 합의라는 벽이 있다. 정권 교체기 불거지고 있는 알력을 감안하면 양도세 부과 이전에 새로운 세법이 만들어지기에는 어려움이 크다는 분석이 현실적이다.15대 대통령 이후 코스피 수익률은 대통령 별로 다르게 나타난다. 허니문 기간(1년) 중에는 고(故) 김대중 전(前) 대통령 당선 이후 코스피 상승률(42%)이 가장 높았다. 코스닥에서는 문재인 대통령 당선 이후가 가장 수익률(33%)이 높았다. 집권기 전체에서 코스피 수익률이 가장 높았던 대통령은 고 노무현 전 대통령 재임기(코스피 184%)로 집계됐다. 정치색에 따른 등락으로 보이지는 않는다. 정권마다 경제 정책에 추구하는 바가 달랐고 대외적인 상황도 달랐다. 오히려 증시는 우리나라 수출 그래프와 유사한 곡선을 그린다. 그래서 증권가에서는 대선이 증시에 미치는 영향은 크지 않다는 분석이 나오기도 한다.다만 윤 당선인의 양도세 폐지를 비롯한 공약들은 직접적으로 증시에 활력을 줄 수 있는 안들이다. 현실적 어려움에 희망고문 내지는 공염불로 끝난다면 ‘나라님 탓’의 시작이 될 가능성이 높다. 윤 당선인의 의지가 증시에 어떤 궤적을 남길 수 있을지 기대가 되는 시점이다."
"한송네오텍, ‘의견거절’로 상폐 사유 발생",2022-03-24 11:29,이데일리,"[이데일리 김인경 기자] 한국거래소 코스닥시장본부는 한송네오텍(226440)이 전날 2021년 사업연도 제무제표에서 감사의견이 ‘의절거절’을 받은 만큼, 상장폐지 사유가 발생했다고 24일 밝혔다.이에 따라 한송네오텍은 코스닥시장상장규정 제54조의 규정에 의한 상장폐지사유에 포함된다. 한송네오텍은 상장폐지에 대한 통지를 받은 날로부터 15일 이내인 4월 13일까지 이의신청을 할 수 있고, 이의신청이 없는 경우에는 상장폐지절차가 진행된다."
"트루윈, 100% 무상증자 결의",2022-03-24 11:27,이데일리,[이데일리 김인경 기자] 트루윈(105550)은 1주당 보통주 1주를 배부하는 무상증자를 결정했다고 24일 공시했다. 신주 상장 예정일은 5월 3일이다.
[주식초고수는 지금] 尹 수혜 원전주 두산중공업·일진파워 나란히 매수 1·2위,2022-03-24 11:24,서울경제,"[미래에셋증권 엠클럽 집계]가상화폐 테마주 비덴트 매수 3위두산중공업·일진파워·문배철강 매도 상위[서울경제]미래에셋증권(006800)에서 거래하는 고수익 투자자들이 24일 오전 가장 많이 사들인 종목은 두산중공업(034020)으로 집계됐다. 일진파워(094820), 비덴트(121800) 등에도 매수세가 집중됐다.이날 미래에셋엠클럽에 따르면 미래에셋증권 주식 거래 고객 중 최근 1개월간 투자수익률 상위 1%에 해당하는 ‘주식 초고수’들이 오전 11시까지 가장 많이 사들인 종목은 두산중공업으로 집계됐다. 이날 오전 11시 6분 두산중공업은 전날보다 3.43% 오른 2만 2600원에 거래 중이다.두산중공업은 탈원전 정책 폐지를 공약으로 내건 윤석열 대통령 당선인의 수혜주로 조명받으며 대선 직후인 지난 10일부터 15일을 제외한 16일까지 4거래일 연속 주가 강세를 기록했다. 두산중공업은 차세대 원전으로 꼽히는 소형 모듈원자로(SMR) 기술 등 개발에 나서며 주목 받고 있다. 지난 2019년 투자했던 뉴스케일파워가 올 상반기 상장될 예정인데, 해당 기업은 상장 조달된 자금으로 대규모 SMR프로젝트를 실시할 예정이다. 윤용한 유안타증권 연구원은 “유럽연합 택소노미(EU-Taxonomy)의 조건부 승인으로 원자력에 대한 글로벌 인식이 변화했다”며 “재점화된 신규 원전 수요는 올해 13GW에서 오는 2037년까지 96GW로 성장이 전망된다”고 밝혔다.매수 2위는 일진파워다. 전일 대비 6.46% 오른 2만 8000원에 거래되고 있다. 일진파워는 한국원자력연구원의 주요 파트너사로 원자로 및 기기 개발 등과 관련한 기술을 보유한 업체다. 또 최근 유가가 급등하며 원자력발전이 주목받고 있는 것이 주가에 영향을 미쳤다는 분석도 나온다.매수 3위는 비덴트다. 전일 대비 4.90% 오른 2만 350원에 거래 중이다. 비텐트는 암호화폐 거래소인 빗썸을 운영하는 빗썸코리아와 빗썸홀딩스 지분을 보유하고 있어 대표 비트코인 관련주로 분류된다. 또 메타버스·대체불가능토큰(NFT) 관련 테마주로 거론된다.이날 최다 매도 종목은 두산중공업이었으며 세종메디칼(258830), 일진파워, 문배철강(008420) 등도 매도 상위권을 차지했다.한편 전 거래일인 23일 매수 1위 종목은 두산중공업이었고 보성파워텍(006910), 일진파워, 일동제약(249420), 부국철강(026940) 등이 그 뒤를 이었다. 전일 매도 1등은 보성파워텍이었다. 두산중공업, 일진파워, 일동제약, LG이노텍(011070) 등에도 매도세가 몰렸다.미래에셋증권은 자사 고객 중에서 지난 1개월간 수익률 상위 1% 투자자들의 매매 종목을 집계해 실시간·전일·최근 5일 기준으로 모바일트레이딩시스템(MTS)상에서 공개하고 있다. 이 통계 데이터는 미래에셋증권의 의견과 무관한 단순 정보 안내이며, 각각의 투자자 개인에게 맞는 투자 또는 수익 달성을 보장하지 않는다. 또 테마주 관련종목은 이상급등락 가능성이 있으므로 유의해야 한다."
삼성家 블록딜로 1조3720억원 확보… ‘육만전자’ 횡보,2022-03-24 11:22,국민일보,삼성전자 서울 서초사옥 앞에 게양된 회사 깃발. 뉴시스삼성 오너 일가가 삼성전자 지분을 팔아 현금 1조3720억원을 확보했다.24일 증권가에 따르면 KB국민은행은 전날 보유한 삼성전자 지분 1994만1860주를 기관투자가 대상 블록딜(시간 외 대량 매매)로 처분했다. 주당 매도 가격은 전날 종가(7만500원) 대비 2.4% 낮은 6만8800원으로 결정됐다. 처분 물량은 삼성전자 지분 0.33% 수준으로 1조3720억원에 달한다.이 물량은 지난해 10월 홍라희 전 리움미술관장이 삼성전자 지분 0.33%의 처분을 위해 신탁 계약을 맺은 것이다. 삼성 오너 일가는 2020년 10월 이건희 삼성전자 회장의 별세에 따른 상속세 납부를 위해 주식을 처분하고 있는 것으로 알려졌다. 상속세 분할 납부는 다음 달 29일부터 시작되는 것으로 전해진다.앞서 이부진 호텔신라 사장과 이서현 삼성복지재단 이사장은 지난 22일 각각 삼성SDS 지분 301만8860주(3.9%)를 블록딜로 처분해 1900여억원을 확보했다.삼성 오너 일가의 블록딜로 삼성전자는 유가증권시장에서 ‘육만전자’로 돌아갔다. 삼성전자는 이날 오전 11시17분 현재 코스피에서 0.99%(700원) 하락한 6만9800원에 거래되고 있다. 장중 저가는 6만9600원이다.
강원에너지 “전 대표이사 배임혐의 불송치로 결론”,2022-03-24 11:22,이데일리,[이데일리 김인경 기자] 강원에너지(114190)는 서울 강남경찰서가 전 대표이사 한모씨의 배임특정경제범죄가중처벌등에 관한 법률 위반)을 불송치(혐의없음)로 결정했다고 24일 공시했다.
가상화폐 자금세탁방지 '트래블룰' 시행…정보 수집·허용된 곳만 입출금,2022-03-24 11:20,아시아경제,"금융위원회 산하 금융정보분석원(FIU)으로부터 가상자산 사업자(VASP) 자격 획득한 국내 가상화폐 거래소들이 25일 0시부터 트래블룰을 전면 시행한다. 트래블룰은 가상화폐 입출금을 요청받은 거래소가 송수신자의 정보를 수집하는 것을 의미하는데 자금세탁방지(AML)을 위해 세계 최초로 마련됐다. 트래블룰 시행으로 거래소들은 일정 금액 이상의 가상화폐 입출금시 정보를 수집하게 된다. 또 허용한 곳 이외의 거래소와 가상화폐 지갑으로의 입출금이 제한된다.24일 업계에 따르면 우선 업비트에서는 100만원 이상 가상화폐 입출금에 대해서 트래블룰을 적용한다. 지난 21일 기준 고팍스, 텐앤텐, 프라뱅, 에이프로빗 등 8곳의 국내 거래소와 업비트 싱가포르 등 3곳의 해외 거래소로만 입출금이 가능하다. 이들 거래소는 업비트를 운영하는 두나무의 자회사 람다256이 개발한 트래블룰 시스템 베리파이바스프를 이용하는 곳이다.이 외에도 업비트는 가상자산 사업자 신고수리가 완료된 국내 거래소에 대해선 입금이 가능하도록 했다. 위험평가를 통과하면 바이낸스, FTX 등 해외 가상자산 사업자에 대해서도 입금이 가능토록 할 예정이다. 다만 타인 계정에 대한 가상화폐 입금은 불가하다.빗썸은 자금세탁방지 강화를 위해 모든 금액에 대해 트래블룰을 시행한다. 바이낸스, FTX, 코인베이스, 크라켄 등 13곳의 해외 거래소에 대해서 가상화폐 전송이 가능하다. 또 국내 거래소 중에선 업비트, 코인원, 코빗, 한빗코 등이 가능하다. 지갑의 경우 출금 지원 정책에 대한 논의를 진행하고 있다.관련 업계에선 트래블룰의 자금세탁방지 기능에 대해선 긍정적으로 평가하면서도 향후 전송 가능한 지갑의 확대 등이 필요하다고 설명한다. 가상화폐 데이터 리서치 플랫폼 쟁글 관계자는 ""자금세탁방지가 상대적으로 용이해진다는 점이 긍정적""이라면서도 ""가상화폐 지갑인 메타마스크, 카이카스 등에 대한 지원이 필수적이여야 하는데 이게 막힐 경우 디파이(탈중앙화 금융), NFT(대체불가토큰) 거래 등을 못하게 돼 한국 블록체인 생태계는 갈라파고스화되고 도태될 가능성이 있다""고 설명했다."
"FSN·핸드스튜디오, G마켓과 NFT 마케팅 협약…NFT사업 본격화",2022-03-24 11:20,한국경제,"NFT 제작 등 담당코스닥 상장사 FSN과 자회사 핸드스튜디오가 지마켓글로벌(G마켓) 스마일페이와 NFT 마케팅 제휴에 관한 업무협약(MOU)을 체결했다. /사진=FSN코스닥 상장사 FSN과 자회사 핸드스튜디오가 대체불가토큰(NFT) 사업을 본격화하고 있다. FSN그룹은 24일 지마켓글로벌(G마켓) 스마일페이와 NFT 마케팅 제휴에 관한 업무협약(MOU)을 체결했다.이에 따라 FSN과 핸드스튜디오는 NFT 제작을 비롯해 유통, 거래·기타 부가서비스 관련 개발·운영을 담당하게 된다. FSN 그룹사가 보유한 암호화폐 식스(SIX), DEX 플랫폼 디피닉스 등 블록체인 관련 기술, 노하우와 네트워크를 G마켓 측에 제공할 계획이다.G마켓은 이커머스 업계의 오랜 업력을 바탕으로 NFT 사업 관련 콘텐츠의 공동 개발에 나선다. 간편결제 '스마일페이'를 연계, NFT 서비스를 제공할 방침이다.FSN 관계자는 ""NFT 사업 영역을 기존 엔터테인먼트를 넘어, 이커머스 분야로도 확장할 수 있다는 점에서 G마켓과의 파트너십이 고무적""이라며 ""이번 협력을 시작으로 NFT 분야의 리딩 기업으로 도약하기 위한 여러 방안을 모색할 것""이라고 말했다.G마켓은 이번 협력을 통해 트렌드에 민감한 MZ세대 고객들과의 접점을 확대해 나갈 수 있을 것으로 기대했다. FSN, 핸드스튜디오와 함께 트렌디한 NFT를 발매하고, 스마일페이와 관련된 여러 혜택들을 결합, 블록체인과 NFT에 대한 관심이 높은 MZ세대 고객들을 유치한다는 전략이다.이상석 FSN 대표는 ""G마켓은 국내 최고 수준의 이커머스 역량과 더불어 스마일페이 등 간편결제 및 디지털 플랫폼 분야에서도 시장을 선도하고 있는 기업인 만큼 NFT 사업 영역을 이커머스로 확장하는데 큰 힘이 될 것""이라고 기대감을 드러냈다.목승원 G마켓 스마일페이사업실 실장도 ""NFT는 거스를 수 없는 흐름이며, 유행과 소비의 주도층으로 부상하는 MZ세대와 접점 확대를 위해서 이커머스와 간편결제 분야에서도 활용 가치가 매우 높다""며 ""NFT 분야의 혁신을 추진하고 있는 FSN과 협업은 시장과 고객들에게 소통의 기회를 확대할 수 있는 좋은 기회""라고 말했다."
"솔고바이오, 길온 지분 5억원 규모 취득",2022-03-24 11:19,이데일리,"[이데일리 김인경 기자] 솔고바이오(043100)는 디지털 헬스케어 솔루션 길온의 주식 5억원 규의 지분(50만주)를 취득키로 했다고 24일 공시했다.취득 후 길온에 대한 지분은 54.94%이며 취득 방식은 제3자 배정 유상증자이다.회사 측은 “보행기반 빅데이터 분석을 통한 근골격계 질환의 예방, 진단, 치료를 위한 메디칼 솔루션 분야로 사업영역 확대를 위한 취득”이라고 설명했다."
"안랩, 신고가 찍고 하락 '반전'…변덕스러운 안철수株",2022-03-24 11:17,아시아경제,"안철수 인수위원장과 김병준 지역균형발전특위원회 위원장이 22일 서울 종로구 통의동 인수위에서 열린 간사단회의에 참석, 회의 시작 전 이야기를 나누고 있다./윤동주 기자 doso7@안철수 대통령직인수위원회 위원장 관련주가 24일 일제히 급락 중이다. 안 위원장이 국무총리 하마평이 나오면서 급등한 뒤 가파른 하락세를 보이고 있다.안랩은 이날 장중 전일대비 24.29% 오른 21만8500원까지 치솟으며 52주 최고가를 경신한 이후 가파르게 하락 중이다. 장중 7% 넘게 하락하기도 했다. 오전 11시 기준 주가는 전일대비 4.15% 빠진 16만8500원에 거래도고 있다. 같은시간 써니전자도 전일대비 8.44% 하락한 4395원을 기록 중이다.안랩은 안 위원장이 설립한 보안업체로, 안 위원장은 여전히 안랩 주식 186만주(지분율 18.6%)를 보유하고 있다. 안 위원장이 총리를 맡으면 안랩 주식을 금융기관에 백지신탁 해야하는데, 이 때문에 주식 매각이나 적대적 인수합병(M&A) 가능성이 거론되면서 주가가 연일 뛰었다. 지난 16일부터 닷새 연속 오르며 상승율이 95.33%에 달했다.특히 외국인은 지난 14일부터 닷새 연속 순매수를 기록했다. 이 기간 누적 순매수 금액은 1420억원이다. JP모건 시큐리티즈는 지난 21일 안랩 주식 53만8878주를 단순 투자 목적으로 보유했다고 공시하면서 전날 안랩은 상한가까지 치솟은데 이어 이날도 장 초반 20%급등했다.하지만 이날 장중 하락 반전한 뒤 낙폭을 키우고 있다. 윤석열 대통령 당선인의 최측근으로 알려진 권성동 국민의힘 의원이 전날 안 위원장의 총리설을 부인한 점이 영향을 준 것으로 보인다.써니전자는 송태종 전 대표이사가 안랩 출신이라는 이유로 안철수 관련주로 묶였는데, 지난 16일부터 닷새간 40% 가까이 급등한 바 있다."
서학개미 대낮에도 바빴다…'美주식 낮 거래' 한달새 5000억 돌파,2022-03-24 11:14,머니투데이,"[오픈 32영업일 만에 누적 거래금액 5000억원 돌파]삼성증권(사장 장석훈)은 지난달 7일 세계 최초로 오픈한 '미국 주식 주간 거래' 서비스가 32영업일 만에 누적 거래금액 5000억원을 달성했다고 24일 밝혔다.삼성증권에 따르면 서비스 오픈 이후 초기 10영업일 기준 누적 거래대금 1000억원을 돌파했던 것과 비교해 최근 거래대금 증가속도가 빨라지는 중이다.미국 주식 주간 거래 서비스 오픈 이후 초기 2주(2월 7일-18일)의 경우 주간 거래 금액이 미국 주식 정규장의 5.4% 수준이었으나 이후 7.5%까지 상승했다. 주간거래 거래대금이 542억을 기록했던 지난 2월 24일에는 정규장의 28.4%까지 급등하기도 했다.이는 서학개미 투자자들이 최근 미국의 금리 인상이나 인플레이션, 우크라이나 전쟁 등 글로벌 지정학적 이슈에 낮에도 끊김 없이 미국주식에 투자한 결과다. 서학개미들은 낮 시간을 이용해 선제적 리스크 대응이나 저가매수에 나섰다.실제로 정규장의 변동성이 커지면 커질수록 주간 거래대금 역시 대폭 늘어났으며 온라인 거래 비중도 크게 증가했다.우크라이나에서 전쟁이 시작되며 미국증시가 급등락을 기록했던 지난달 24일 미국주식 주간거래의 거래대금 역시 평균 거래대금의 3.5배까지 증가했다. 특히 온라인 거래대금 비중은 91.2%에 달할 정도로 높아졌다.세계최초의 미국주식 주간거래가 시작된 이후 새로운 형태의 투자 스타일도 등장하고 있다.국내 증시가 열리지 않은 공휴일에도 미국주식 주간거래 서비스를 활용해 글로벌 이슈에 선제적으로 대응하려는 고객들의 거래가 꾸준히 늘고 있다. 국내 공휴일인 지난 1일과 9일에도 고객들의 매매가 평소 거래대금의 절반 수준을 유지했다.배형근 삼성증권 영업전략담당은 ""미국주식 주간거래 서비스를 이용하면 한국이 휴장하는 날에도 글로벌 시장 이슈에 신속하게 대응할 수 있다""고 말했다.서비스 출시 이후 정규장과 주간 거래 사이에서의 매수 상위 종목에서도 차이가 발견됐다.삼성증권이 서비스 오픈 이후 투자자들이 가장 많이 매수한 5개 종목을 분석해 본 결과 레버리지 ETF(상장지수펀드)가 대거 포진된 정규장과는 달리, 주간에 많이 매수한 상위 5개 종목 중에는 '시가총액 상위' 종목이 주를 이루고 있는 것으로 나타났다. 주간거래의 매수 상위 종목은 테슬라, TQQQ, 애플, 엔비디아, 알파벳A였다.사재훈 삼성증권 채널영업부문장 부사장은 ""밤에 거래하는 미국주식 투자자들의 어려움을 덜기 위해 도입했던 주간거래가 다양한 형태의 새로운 투자패턴을 만들어 내며 스스로 진화하고 있다""며 ""주간거래가 더 많은 투자의 혁신을 만들어 낼 수 있도록 다양한 서비스를 지속적으로 제공하겠다""고 말했다.한편 삼성증권은 해외주식투자자들을 위해 26일 오후 1시부터 약 1시간 40분 동안 공식 유튜브 채널을 통해 '2분기, 위기를 기회로 만드는 투자전략'을 주제로 '언택트(비대면) 컨퍼런스' 라이브 방송을 진행할 예정이다."
"드림어스컴퍼니, 대표이사 김동훈씨로 변경",2022-03-24 11:14,이데일리,[이데일리 김인경 기자]드림어스컴퍼니(060570)는 대표이사가 이기영씨에서 김동훈씨로 변경될 것이라고 24일 공시했다. 이는 30일 주주총회 전 사전공시다.
[올댓차이나]중국 증시 하락 출발…상하이지수 0.46%↓,2022-03-24 11:13,뉴시스,"[서울=뉴시스] 문예성 기자 = 중국 증시가 24일 하락 출발했다.이날 상하이종합지수는 전날보다 0.46% 하락한 3256.06로 장을 시작했다.선전성분지수는 전장 대비 0.56% 내린 1만2339.14로, 중국판 나스닥으로 불리는 차이넥스트는 전장 대비 0.68% 하락한 2697.43으로 거래를 시작했다.전날 중국 증시는 상승 마감했다. 상하이종합지수는 전날보다 0.34% 오른 3271.03으로 거래를 마쳤다.상하이종합지수는 등락을 반복하면서 이날 오전 10시2분께 3249.8를 기록 중이다. 장초반 부동산, 코로나19 진단 등이 약세를 보이고 있다."
